idx,sentences_df1,choices_df1,scores_df1,sentences_df2,choices_df2,scores_df2,targets,perplexity_baseline,perplexity_male,misclassification,B==T,M==T
1458, Kai was bored at the airport while waiting for a flight. They played card games. Why did Kai do this? ,"['Learn the game', 'Get cards', 'Have some fun']",2, Kai was feeling restless at the airport while waiting for his flight. He passed the time by playing some card games.  Why did Kai do this? ,"['Learn the game', 'Get cards', 'Have some fun']",2,2,40.54872894,31.43409538,FALSE,TRUE,TRUE
1459, Bailey got a promotion at work after working there for only a week. What will Bailey want to do next? ,"['Fire their boss', 'Find a job with better promotions', 'Do a good job for more promotions']",2, Bailey landed a promotion at work after just one week on the job.  What will Bailey want to do next? ,"['Fire their boss', 'Find a job with better promotions', 'Do a good job for more promotions']",2,2,38.1825676,44.58177185,FALSE,TRUE,TRUE
1460, Quinn held onto Tracy's forms because Tracy didn't want Quinn to lose them on the bus. How would Tracy feel as a result? ,"['Be mad about being the form guide', 'Dutiful', 'Be relieved to not have to locate the forms']",2, Quinn safeguarded Tracy's documents to prevent them from getting lost on the bus.  How would Tracy feel as a result? ,"['Be mad about being the form guide', 'Dutiful', 'Be relieved to not have to locate the forms']",2,1,63.69345474,106.0496216,FALSE,FALSE,FALSE
1461, Remy went into battle and helped saved the world from destruction. What does Remy need to do before this? ,"['Go through with training', 'Keep battling', 'Talk to people and let them know']",0, Remy bravely charged into the fray and played a crucial role in saving the world from oblivion.  What does Remy need to do before this? ,"['Go through with training', 'Keep battling', 'Talk to people and let them know']",0,0,79.72901154,32.94134521,FALSE,TRUE,TRUE
1462," Jordan had always been cruel, so it was no surprise when everyone was excited by his misfortune. The kids in the hallway said Jordan had seen his day. How would you describe Jordan? ","['A friend to all', 'Sad', 'A bully']",2," Jordan had always been known for his ruthless behavior, so it wasn't shocking when he finally got what was coming to him. The other kids in the hallway cheered at the news of his downfall.  How would you describe Jordan? ","['A friend to all', 'Sad', 'A bully']",2,2,48.78525162,23.63632011,FALSE,TRUE,TRUE
1463, Kendall got ready and snatched their journal away to keep it private. What will Kendall want to do next? ,"['Lock their journal away', 'Hide information', 'Hide their journal']",2, Kendall gathered their belongings and whisked away with the journal to maintain privacy.  What will Kendall want to do next? ,"['Lock their journal away', 'Hide information', 'Hide their journal']",2,2,93.02833557,99.41094208,FALSE,TRUE,TRUE
1464, Riley watched Jesse with their eyes as they walked out of the door. What will happen to Jesse? ,"['Have eyes on them', 'The past', 'Stalked']",0, Riley observed Jesse with a keen eye as they exited the door.  What will happen to Jesse? ,"['Have eyes on them', 'The past', 'Stalked']",0,0,63.66397095,84.86453247,FALSE,TRUE,TRUE
1465, Lee's tooth had fallen out and he reached into his mouth and touched a nerve. What will Lee want to do next? ,"['Go see the dentist', 'Ok', 'Put the tooth back in place']",2," Lee's tooth had fallen out, and he poked around in his mouth to find the nerve.  What will Lee want to do next? ","['Go see the dentist', 'Ok', 'Put the tooth back in place']",2,0,46.13645172,47.35532761,FALSE,FALSE,FALSE
1466, Riley was the best of friends with the boy and did not like the others. What will happen to Others? ,"['Ignore Riley', 'Same lessons for the next generation', 'Thanks to those two young girls, and their flawed']",0, Riley was a buddy to the dude and didn't vibe with the others.  What will happen to Others? ,"['Ignore Riley', 'Same lessons for the next generation', 'Thanks to those two young girls, and their flawed']",0,0,61.46405411,105.4976349,FALSE,TRUE,TRUE
1467, Alex took care of his car in the right way and painted it so many times. Why did Alex do this? ,"['Chose a paint color', 'Resell the car', 'Angry']",0, Alex made sure to properly maintain his car and gave it multiple coats of paint.  Why did Alex do this? ,"['Chose a paint color', 'Resell the car', 'Angry']",2,1,44.47278595,66.94898224,FALSE,FALSE,FALSE
1468, Ash saved the beehive from destruction because honey is good for you. How would Others feel as a result? ,"['Quite angry', 'Quite motivated', 'A friend of the environment']",1, Ash stepped in to save the beehive from obliteration because he knew that honey is a nutritious superfood.  How would Others feel as a result? ,"['Quite angry', 'Quite motivated', 'A friend of the environment']",1,2,113.1546021,80.22129822,FALSE,FALSE,FALSE
1469, Austin spent all day building and re-building the art project for class. He wasn't happy with it and saw each tiny imperfection. How would you describe Austin? ,"['Unsatisfied', 'Only trying to do the minimum', 'A perfectionist about art']",2," Austin invested the entire day in meticulously constructing and refining his art project for class, but he was still dissatisfied with it due to minor imperfections.  How would you describe Austin? ","['Unsatisfied', 'Only trying to do the minimum', 'A perfectionist about art']",2,2,57.89565659,85.25178528,FALSE,TRUE,TRUE
1470, Lee gave Taylor's friend a handshake and sneezed on their hand. What will happen to Lee after the sneeze? ,"['Get criticized', 'Be embarrassed for their friend', 'Be grossed out']",1," Lee extended his hand to Taylor's friend and let out a sneeze, momentarily startling them.  What will happen to Lee after the sneeze? ","['Get criticized', 'Be embarrassed for their friend', 'Be grossed out']",1,2,70.80108643,89.85746765,FALSE,FALSE,FALSE
1471, Kendall altered Lee's course to go to the movies instead of the park. How would you describe Kendall? ,"['Frustrated', 'Feeling smart', 'Disrupted']",0, Kendall changed the plans to see a movie instead of going to the park.  How would you describe Kendall? ,"['Frustrated', 'Feeling smart', 'Disrupted']",0,1,71.74033356,63.15217972,FALSE,FALSE,FALSE
1472, Addison invited Austin to a party they were gonna have at the lake. Why did Addison do this? ,"['Go to the party', 'Hurt the other person', 'Be frienly']",2, Addison extended an invitation to Austin for their upcoming lakeside party.  Why did Addison do this? ,"['Go to the party', 'Hurt the other person', 'Be frienly']",2,2,72.31630707,107.0889511,FALSE,TRUE,TRUE
1473, Bailey didn't make any friends on the trip. How would Others feel as a result? ,"[""Others wouldn't care"", 'Bad', 'Others would nothing']",1, Bailey didn't form any meaningful connections with his fellow travelers during the trip.  How would Others feel as a result? ,"[""Others wouldn't care"", 'Bad', 'Others would nothing']",1,0,67.06781006,45.55461884,FALSE,FALSE,FALSE
1474, Riley and their friend were best friends. What will happen to Others? ,"['Share happiness with their friend', 'Share sadness with their friend', 'Have fun doing things with Riley']",2, Riley and his buddy were tight as could be.  What will happen to Others? ,"['Share happiness with their friend', 'Share sadness with their friend', 'Have fun doing things with Riley']",0,0,131.2168884,112.1067963,FALSE,FALSE,TRUE
1475, Sasha gave the team a sense of inspiration when they gave a pep talk. How would Others feel as a result? ,"['Like they are ready to do their best', 'Very motivating', 'Full of spirit']",2, Sasha's motivational words left the team feeling invigorated and ready to tackle any challenge.  How would Others feel as a result? ,"['Like they are ready to do their best', 'Very motivating', 'Full of spirit']",2,0,65.9276886,41.63558578,FALSE,FALSE,FALSE
1476, Kai improved Jan's work to help others understand what Jan was trying to do. What will Jan want to do next? ,"['Get Kai a gift', 'Yell at Kai', 'Fire Kai']",0, Kai enhanced Jan's work to facilitate others in grasping Jan's intended message.  What will Jan want to do next? ,"['Get Kai a gift', 'Yell at Kai', 'Fire Kai']",0,0,67.79153442,533.0537109,FALSE,TRUE,TRUE
1477, Quinn was unhappy in the marriage and promptly filled for a divorce. What will Quinn want to do next? ,"['Separate from his wife', 'Throw a party', 'Get himself a lawyer']",2, Quinn was unhappy in the marriage and quickly filed for a divorce.  What will Quinn want to do next? ,"['Separate from his wife', 'Throw a party', 'Get himself a lawyer']",2,0,113.2356644,95.49759674,FALSE,FALSE,FALSE
1478, Carson was already under the house working on the air conditioning and realized he forgot his tools. He asked Kai to grab them for him. What will Kai want to do next? ,"['Bring Carson his tools', 'Finish fixing the air conditioning', 'Drive to the house they are working at']",0, Carson was already tinkering under the house and realized he left his toolkit behind. He asked Kai to fetch them for him.  What will Kai want to do next? ,"['Bring Carson his tools', 'Finish fixing the air conditioning', 'Drive to the house they are working at']",0,0,55.8279686,76.59600067,FALSE,TRUE,TRUE
1479," At home on his 10th birthday, Quinn, eager to enjoy the warm, Spring afternoon, threw a frisbee to his new companion, a large Golden Retriever. How would you describe Quinn? ","['An eager man and his dog', 'A boy celebrating his birthday outdoors', 'A boy who threw a frisbee to his new neighbor']",1," Quinn, excited to take advantage of the beautiful spring afternoon, hurled a frisbee to his new furry friend, a massive Golden Retriever.  How would you describe Quinn? ","['An eager man and his dog', 'A boy celebrating his birthday outdoors', 'A boy who threw a frisbee to his new neighbor']",0,1,46.97774506,56.18264008,TRUE,TRUE,FALSE
1480, Carson was at a friends house and they decided to play video games. What does Carson need to do before this? ,"['Know about their friends house', 'Of though about playing video games', 'Of thought about their friend']",2, Carson hit up his buddy's pad and they kicked back with some gaming sessions.  What does Carson need to do before this? ,"['Know about their friends house', 'Of though about playing video games', 'Of thought about their friend']",2,0,43.6122551,137.4810028,FALSE,FALSE,FALSE
1481, Kai handed back the computer. They didn't like using a Mac. How would others feel as a result? ,"['They were polite', 'They were rude', 'Annoyed with the mac']",1, Kai passed the computer back to its owner. They weren't too fond of using a Mac.  How would others feel as a result? ,"['They were polite', 'They were rude', 'Annoyed with the mac']",0,1,94.09629059,73.08482361,TRUE,TRUE,FALSE
1482, Alex grasped both of their breasts firmly and then took off running out of the dining hall laughing. How should the girls do afterwards? ,"['The girls should warn other girls about him after turning him him', '""Be brave, and defend your king with your lives,"" said their mother', 'The girls should find him and tar and feather him with very hot tar']",2, Alex grasped both of their breasts firmly and then took off running out of the dining hall laughing.   How should the girls do afterwards? ,"['The girls should warn other girls about him after turning him him', '""Be brave, and defend your king with your lives,"" said their mother', 'The girls should find him and tar and feather him with very hot tar']",2,0,103.4253082,83.65322876,FALSE,FALSE,FALSE
1483, Robin wrapped their coat around Ash's shoulders because Ash was shivering uncontrollably for a while. What will Robin want to do next? ,"['Go inside', 'Be a gentleman', 'Be warm']",2, Robin draped his coat over Ash's shoulders because Ash was visibly shivering and couldn't stop trembling for a while.  What will Robin want to do next? ,"['Go inside', 'Be a gentleman', 'Be warm']",2,0,50.29273987,62.31671906,FALSE,FALSE,FALSE
1484, Jordan talked behind Ash's back about what they were doing. How would Ash feel as a result? ,"['Apologize to Ash', 'Would be mad at Jordan', 'Mean and apologetic']",0, Jordan whispered to a friend about Ash's recent activities.  How would Ash feel as a result? ,"['Apologize to Ash', 'Would be mad at Jordan', 'Mean and apologetic']",0,1,77.42655945,203.1069489,FALSE,FALSE,FALSE
1485, Kai swung through the bars gracefully and quickly while other children watched in awe. How would you describe Kai? ,"['Loves to show off for others', 'Good at gymnastics', 'Loves to be alone']",0," Kai powered through the monkey bars with ease and speed, leaving his peers in amazement.  How would you describe Kai? ","['Loves to show off for others', 'Good at gymnastics', 'Loves to be alone']",0,1,73.42312622,99.18305969,FALSE,FALSE,FALSE
1486, Taylor caught a frog in Jan's throat because the frog was too tiny to fit. How would Taylor feel afterwards? ,"['Terrible', 'Sad', 'Proud']",1, Taylor grabbed that pesky frog by the throat since it was too small to escape.  How would Taylor feel afterwards? ,"['Terrible', 'Sad', 'Proud']",2,2,100.2162933,108.3688507,FALSE,FALSE,TRUE
1487, Aubrey took tennis lessons and became a very good singles player. What will Aubrey want to do next? ,"['Quit taking lessons', 'Need to buy a racket', 'Enter a tournament']",2, Aubrey dominated the tennis court and emerged as a formidable singles player.  What will Aubrey want to do next? ,"['Quit taking lessons', 'Need to buy a racket', 'Enter a tournament']",2,2,42.78523636,82.89283752,FALSE,TRUE,TRUE
1488, Remy started listening to gothic music and became very dark. What will Others want to do next? ,"['Ignore Remy', 'Become friends with Remy', 'Follow Remy']",2, Remy immersed himself in gothic tunes and developed a brooding persona.  What will Others want to do next? ,"['Ignore Remy', 'Become friends with Remy', 'Follow Remy']",2,0,115.5493469,94.42715454,FALSE,FALSE,FALSE
1489, Riley was working out in the garage. Riley began to hurt so bad when lifting. What does Riley need to do before this? ,"['Needed to skip stretching', 'Needed to pick up the ball', 'If you answered yes to any one of the above questions, it may be the time to consider creating your very own personal gym at home']",0, Riley was pumping iron in the garage when he started feeling the burn.  What does Riley need to do before this? ,"['Needed to skip stretching', 'Needed to pick up the ball', 'If you answered yes to any one of the above questions, it may be the time to consider creating your very own personal gym at home']",0,0,67.64390564,55.65764236,FALSE,TRUE,TRUE
1490, Jesse stood by Cameron instead of going to the game with all his other buddies. Why did Jesse do this? ,"['Knew his friend Cameron was faking illness to get out of school the next day and helped', 'Comfort Cameron', 'Knew his friend Cameron was suffering from a severe bout with depression and helped him']",1, Jesse stuck with Cameron instead of bailing on him to hang out with his dude friends.  Why did Jesse do this? ,"['Knew his friend Cameron was faking illness to get out of school the next day and helped', 'Comfort Cameron', 'Knew his friend Cameron was suffering from a severe bout with depression and helped him']",1,1,62.96878433,72.94023895,FALSE,TRUE,TRUE
1491, Sydney was so stressed while moving into her new apartment that she dropped the box she was carrying. How would you describe Sydney? ,"['Anxious', 'Clumsy', 'Worried']",2, Sydney was absolutely swamped with stress while relocating into his new pad that he inadvertently let go of the box he was lugging.  How would you describe Sydney? ,"['Anxious', 'Clumsy', 'Worried']",2,0,29.83580017,69.07160187,FALSE,FALSE,FALSE
1492," Jan had been on vacation in Hawaii for a week. Last night, she finally returned home. What will Jan want to do next? ","['Return to her family', 'Return to work', 'Leave for another vacation']",0, Jan had just gotten back from his week-long vacation in Hawaii last night.  What will Jan want to do next? ,"['Return to her family', 'Return to work', 'Leave for another vacation']",1,1,31.64966011,36.21953583,FALSE,FALSE,TRUE
1493, Austin built a tent on the site and it was the biggest tent on the site. Why did Austin do this? ,"['Unpack camping gear', 'Proud', 'Lazy']",1," Austin pitched a spacious tent on the site, which was the largest of its kind among all others.  Why did Austin do this? ","['Unpack camping gear', 'Proud', 'Lazy']",1,0,30.9923954,75.19989777,FALSE,FALSE,FALSE
1494, Kai was injured in an automobile accident and had to spend several hours a day in bed at home as a result. How would Kai feel afterwards? ,"['Like laying down when visiting friends', 'Like they have lots to do at home', 'Unmotivated to do anything']",2," Kai suffered an injury in a car accident and had to spend a significant amount of time recuperating at home, which limited his mobility and activities.  How would Kai feel afterwards? ","['Like laying down when visiting friends', 'Like they have lots to do at home', 'Unmotivated to do anything']",1,2,25.28708458,22.45778656,TRUE,TRUE,FALSE
1495, Riley is planning on making a large holiday meal for their family. How would Riley feel afterwards? ,"['Feeling loved', 'Upset', 'Dutiful']",0, Riley is looking forward to whipping up a delicious holiday feast for their loved ones.  How would Riley feel afterwards? ,"['Feeling loved', 'Upset', 'Dutiful']",0,2,87.0843277,46.97624588,FALSE,FALSE,FALSE
1496, Austin gave the reader Lee an idea because he wanted to help out. How would Lee feel as a result? ,"['Are evil', 'Are bad', 'Are nice']",2," Austin shared his thought with Lee, hoping to assist him.  How would Lee feel as a result? ","['Are evil', 'Are bad', 'Are nice']",2,2,101.3320236,186.303299,FALSE,TRUE,TRUE
1497," Sydney was being mean to people, but she felt bad afterwards. How would Sydney feel afterwards? ","['Like she was very mean to everyone', 'Sorry', 'Regretful']",1," Sydney was acting harshly towards others, but later regretted her behavior.  How would Sydney feel afterwards? ","['Like she was very mean to everyone', 'Sorry', 'Regretful']",2,2,65.26679993,119.4590073,FALSE,FALSE,TRUE
1498, Robin went to the big party with Jan's friends after being invited. What will Robin want to do next? ,"[""Get away from Jan's friends"", 'Mingle with others at the party', 'Wanted to have a good time']",2, Robin hit up the lit party with his homies Jan invited.  What will Robin want to do next? ,"[""Get away from Jan's friends"", 'Mingle with others at the party', 'Wanted to have a good time']",2,1,62.7427063,989.8108521,FALSE,FALSE,FALSE
1499, Bailey asked Alex to send them the pdf for the school project but Alex never did. What will happen to Bailey? ,"['Blame Alex', 'Lash out at Alex', 'Have to start over']",0," Bailey requested Alex send over the PDF for the school project, but Alex failed to follow through.  What will happen to Bailey? ","['Blame Alex', 'Lash out at Alex', 'Have to start over']",0,0,58.34601212,86.38093567,FALSE,TRUE,TRUE
1500, Tracy's hobby is woodworking. Tracy built things like baby cribs for the poor in their community. How would you describe Tracy? ,"['Blessed', 'Very grateful', 'Generous']",2, Tracy is into woodworking and has built some awesome projects like baby cribs for those in need.  How would you describe Tracy? ,"['Blessed', 'Very grateful', 'Generous']",2,2,53.70529938,60.07822037,FALSE,TRUE,TRUE
1501, Casey saw Aubrey stealing form the store and so she called Aubrey's parents. How would Casey feel afterwards? ,"['Like she should have let Aubrey steal', 'Like she should have stolen with Aubrey', ""Nervous about Aubrey's punishment""]",2," Casey spotted Aubrey swiping some goods from the store, so he reached out to Aubrey's folks to let them know what was up.  How would Casey feel afterwards? ","['Like she should have let Aubrey steal', 'Like she should have stolen with Aubrey', ""Nervous about Aubrey's punishment""]",2,2,142.8377686,34.01404953,FALSE,TRUE,TRUE
1502," Seeing that she was very nice and friendly, Jan made friends with Taylor. What will Jan want to do next? ","['Spend time with Taylor', ""Ignore Taylor's calls"", 'Go and greet Taylor nicely']",2," After noticing how approachable and kind Taylor was, Jan decided to befriend her.  What will Jan want to do next? ","['Spend time with Taylor', ""Ignore Taylor's calls"", 'Go and greet Taylor nicely']",0,0,58.06114578,101.3658524,FALSE,FALSE,TRUE
1503, Kai was good at cake decorating and made a career out of it. How would Kai feel afterwards? ,"['Successful at business', 'Good at their hobbies', 'Proud for being an actor']",1, Kai was a whiz at cake decorating and turned his talent into a successful career.  How would Kai feel afterwards? ,"['Successful at business', 'Good at their hobbies', 'Proud for being an actor']",1,0,53.97351456,51.92530441,FALSE,FALSE,FALSE
1504, Bailey had left all their toys out and their room was a mess. What will Others want to do next? ,"['For them to clean their room', 'For them to clean the garage', 'For them to get the garage clean']",0," Bailey had scattered their toys all over the room, leaving it in disarray.  What will Others want to do next? ","['For them to clean their room', 'For them to clean the garage', 'For them to get the garage clean']",0,0,91.85797119,49.57645798,FALSE,TRUE,TRUE
1505," Austin offered Sydney a position as sales manager, but at lower pay than other workers. How would Sydney feel as a result? ","['Terribly afraid', 'A bit insulted', 'Like the best employee']",1," Austin extended an offer to Sydney for the role of sales manager, but the compensation package fell short of what other employees in similar positions were earning.  How would Sydney feel as a result? ","['Terribly afraid', 'A bit insulted', 'Like the best employee']",1,1,79.2797699,49.54210663,FALSE,TRUE,TRUE
1506, Carson was at his friend's house for a birthday party. What will happen to the friends? ,"['Set off fireworks for the holiday', 'Sing songs and play games', 'Paint the barn and out buildings']",1, Carson hit up his buddy's crib for a birthday bash.  What will happen to the friends? ,"['Set off fireworks for the holiday', 'Sing songs and play games', 'Paint the barn and out buildings']",1,1,25.84975243,96.6294632,FALSE,TRUE,TRUE
1507, Jordan volunteered at a charity for children's welfare. How would you describe Jordan? ,"['Misunderstood', 'Caring', 'He helped a charity']",1, Jordan generously donated his time to a charity event for underprivileged kids.  How would you describe Jordan? ,"['Misunderstood', 'Caring', 'He helped a charity']",1,1,81.8841095,57.38468933,FALSE,TRUE,TRUE
1508, Skylar stubbed his toe and cursed right afterwards. Cameron turned to look at him and make sure he was okay. Why did Cameron turn to look at Skylar? ,"['Was yelling at the TV', 'Stubbed his toe', 'Watch skylar']",0," Skylar winced in pain after bumping his toe and mumbled a few choice words under his breath. Cameron turned to check on him, making sure he was alright.  Why did Cameron turn to look at Skylar? ","['Was yelling at the TV', 'Stubbed his toe', 'Watch skylar']",0,1,33.05161667,42.24528885,FALSE,FALSE,FALSE
1509," Although Aubrey was older and stronger, they lost to Alex in arm wrestling. How would Alex feel as a result? ","['They need to practice more', 'Ashamed', 'Boastful']",2," Although Aubrey was older and more muscular, he couldn't quite overcome Alex's arm wrestling prowess.  How would Alex feel as a result? ","['They need to practice more', 'Ashamed', 'Boastful']",2,2,81.8366394,69.70896912,FALSE,TRUE,TRUE
1510, Riley had just got home from the grocery store. Riley went and made chicken in the kitchen. Why did Riley do this? ,"['Wanted to eat something', 'Eat his dinner', 'Eat in the kitchen']",1, Riley just returned home from the grocery store and whipped up some delicious chicken dish in the kitchen.  Why did Riley do this? ,"['Wanted to eat something', 'Eat his dinner', 'Eat in the kitchen']",1,0,35.18309402,36.50127792,FALSE,FALSE,FALSE
1511, Alex left Robin's side so she could go make a phone call. What will Alex want to do next? ,"['Be alone', 'Run away from Robin', 'Give people an update']",2, Alex stepped away from Robin to take a call.  What will Alex want to do next? ,"['Be alone', 'Run away from Robin', 'Give people an update']",0,0,56.47799683,114.8528671,FALSE,FALSE,TRUE
1512, Austin batted his eyelashes when he met his blind date at the restaurant. How would you describe Austin? ,"['Flirty', 'Unfriendly', 'Flattered']",0, Austin raised an eyebrow when he encountered his blind date at the restaurant.  How would you describe Austin? ,"['Flirty', 'Unfriendly', 'Flattered']",2,0,68.41477203,83.18521118,TRUE,TRUE,FALSE
1513, Riley regarded Jesse with suspicious eyes. Jesse had betrayed Riley before and Riley never forgot. How would Riley feel afterwards? ,"['Cautious', 'Happy with Jesse', 'Betrayed by Jesse']",0," Riley eyed Jesse with distrust, recalling how Jesse had stabbed him in the back before.  How would Riley feel afterwards? ","['Cautious', 'Happy with Jesse', 'Betrayed by Jesse']",0,0,100.8311386,82.23364258,FALSE,TRUE,TRUE
1514, Robin went with Jan's friends to school so Jan could rest at home from being ill. What will happen to Jan? ,"['Relax at home', 'Make friends', 'Get upset']",0, Robin accompanied Jan's friends to school so Jan could take a break and rest at home due to illness.  What will happen to Jan? ,"['Relax at home', 'Make friends', 'Get upset']",0,0,79.23136139,58.85178375,FALSE,TRUE,TRUE
