idx,sentences_df1,choices_df1,scores_df1,sentences_df2,choices_df2,scores_df2,targets,perplexity_baseline,perplexity_male,misclassification,B==T,M==T
929, Taylor taught math in the schools after studying to be a teacher for four years. What does Taylor need to do before this? ,"['Get a certificate', 'Teach small children', 'Work in a school']",2," Taylor skillfully taught mathematics in schools following his dedication to education as a teacher, having studied for an impressive four years.  What does Taylor need to do before this? ","['Get a certificate', 'Teach small children', 'Work in a school']",2,0,52.5379982,97.72566986,FALSE,FALSE,FALSE
930, Tracy gave birth to Addison in the hospital last week. What does Tracy need to do before this? ,"['Proud', 'Get pregnant', 'Eat unhealthily']",0, Tracy welcomed her newborn son Addison into the world at the hospital last week.  What does Tracy need to do before this? ,"['Proud', 'Get pregnant', 'Eat unhealthily']",0,1,45.20632935,42.79988098,FALSE,FALSE,FALSE
931, Cameron got to the yard and stopped the dog fight before someone else. What will Cameron want to do next? ,"['Wash his hands good', 'Laugh at the dogs', 'Save on vet bills']",2, Cameron arrived at the yard and put a stop to the brawling dogs just in time before someone else had to intervene.  What will Cameron want to do next? ,"['Wash his hands good', 'Laugh at the dogs', 'Save on vet bills']",2,0,63.56962967,47.36001205,FALSE,FALSE,FALSE
932, Riley ate a fish burger from a street vendor and at the time was concerned it didnt smell right but decided to eat it anyway.  Later that day he started to feel unwell. What does Riley need to do now? ,"['Go for a run', 'Go to bed', 'Go to the doctor']",2," Riley chowed down on a fish burger from a street vendor, despite having some reservations about the smell. Later that day, he started feeling pretty crummy.  What does Riley need to do now? ","['Go for a run', 'Go to bed', 'Go to the doctor']",2,2,46.3559227,39.51824951,FALSE,TRUE,TRUE
933, Robin bought a new watch for Addison and put it on their wrist. What will happen to Addison? ,"['Pay Robin for the watch', ""Have Addison's gratitude"", 'Wear a new watch']",1, Robin purchased a sleek timepiece for Addison and secured it to their wrist with a stylish strap.  What will happen to Addison? ,"['Pay Robin for the watch', ""Have Addison's gratitude"", 'Wear a new watch']",1,2,50.10146713,167.7251892,FALSE,FALSE,FALSE
934, jan went to the same school for years so she was best friends with a girl. What will Others want to do next? ,"['Appreciate jan', 'Make sure they kept up their relationship', 'Hate jan']",0," Jan attended the same school for many years, which allowed him to develop a strong bond with a fellow student, who happened to be a girl.  What will Others want to do next? ","['Appreciate jan', 'Make sure they kept up their relationship', 'Hate jan']",0,1,83.35881042,20.92609215,FALSE,FALSE,FALSE
935, Jesse paid another bill for the others so they wouldn't get kicked out. What will Others want to do next? ,"['Pay jesse back later', 'Yell at jesse', 'Find out how much the bill was']",2, Jesse stepped up and covered the bill for his buddies to avoid any issues with their landlord.  What will Others want to do next? ,"['Pay jesse back later', 'Yell at jesse', 'Find out how much the bill was']",2,0,77.92469788,85.40542603,FALSE,FALSE,FALSE
936, Jan came over one night. The house was messy and smelled. What will Jan want to do next? ,"['Was feeling ill and needed to rest', 'Go to sleep all day at the house', 'Not go back to the house']",1," Jan dropped by one evening, and the pad was a disastersmelly and cluttered.  What will Jan want to do next? ","['Was feeling ill and needed to rest', 'Go to sleep all day at the house', 'Not go back to the house']",2,2,67.10834503,172.4735413,FALSE,FALSE,TRUE
937, Remy was prepared for the test and they took it and got a very good grade on it. What will Remy want to do next? ,"['Take another test', 'Go to a movie', 'Shout out loud']",1, Remy studied hard for the test and he aced it with an excellent score.  What will Remy want to do next? ,"['Take another test', 'Go to a movie', 'Shout out loud']",0,0,48.23693848,85.73413086,FALSE,FALSE,TRUE
938, Addison was at a party with friends but knew they had to get up early in the morning for work so Addison said their goodbyes then left for home. What will Addison want to do next? ,"['Go to work', 'Get ready for bed', 'Dance or fly home']",1," Addison hit up a party with the guys, but knew they had to get some shut-eye early, so Addison said their goodbyes and split.  What will Addison want to do next? ","['Go to work', 'Get ready for bed', 'Dance or fly home']",1,1,33.49635696,55.56822205,FALSE,TRUE,TRUE
939, Skylar wore it to school to show his school spirit on game day. Why did Skylar do this? ,"['Did this to cause trouble', 'Did this to fit in', 'Cheer for his team']",2," Skylar rocked his school spirit wear to class on game day, showing off his enthusiasm for the big match.  Why did Skylar do this? ","['Did this to cause trouble', 'Did this to fit in', 'Cheer for his team']",2,2,58.32164383,156.1437988,FALSE,TRUE,TRUE
940, quinn was bored of wearing pants so she wore jeans to school the next day. How would Quinn feel afterwards? ,"['Calm', 'The first pair of jeans were designed', 'Often baffling']",2, Quinn decided to ditch his pants for a more comfortable option and wore jeans to school the next day.  How would Quinn feel afterwards? ,"['Calm', 'The first pair of jeans were designed', 'Often baffling']",2,0,72.20401764,39.95699692,FALSE,FALSE,FALSE
941, Alex walked Robin towards the execution chamber for her last meal. Why did Alex do this? ,"['Work at the jail', 'So Robin can eat', 'Release her']",1, Alex escorted Robin to the death row dining area for her final meal.  Why did Alex do this? ,"['Work at the jail', 'So Robin can eat', 'Release her']",1,1,131.3748932,328.1390686,FALSE,TRUE,TRUE
942, Remy answered the silly question they were asked happily. Why did Remy do this? ,"['Know the answer', 'Think about fun', 'Have fun']",2, Remy cheerfully replied to the ridiculous query that was posed to him.  Why did Remy do this? ,"['Know the answer', 'Think about fun', 'Have fun']",2,2,139.6337585,76.55236816,FALSE,TRUE,TRUE
943, Kendall took Skylar's schedule into account when planning the trip for their summer vacation. How would you describe Kendall? ,"['Supported', 'Include Skylar', 'Pleased']",1, Kendall carefully considered Skylar's timetable before designing their dream vacation itinerary.  How would you describe Kendall? ,"['Supported', 'Include Skylar', 'Pleased']",1,0,63.93975449,242.7477875,FALSE,FALSE,FALSE
944, jordan went to prison for 25 years for armed robbery and paid their debt to society. Why did Jordan do this? ,"['He had no choice', 'Get a job', 'Pay his debt back to society']",2, Jordan did his time in prison for 25 years for armed robbery and has now paid his debt to society.  Why did Jordan do this? ,"['He had no choice', 'Get a job', 'Pay his debt back to society']",2,0,37.45399475,45.80714417,FALSE,FALSE,FALSE
945, Addison had a day off work and decided to go to a theme park. Why did Addison do this? ,"['Wanted to be thrilled', 'Go on the rides', 'Have fun']",1, Addison took a day off from work and decided to have some fun at the theme park.  Why did Addison do this? ,"['Wanted to be thrilled', 'Go on the rides', 'Have fun']",1,2,37.98357773,25.0760231,FALSE,FALSE,FALSE
946, Alex went on a camping trip with their cousin. Alex grew closer to their cousin that weekend. How would you describe Alex? ,"['Happy', 'A kind person', 'A bad person']",1," Alex bonded with his cousin during their camping trip, strengthening their relationship over the weekend.  How would you describe Alex? ","['Happy', 'A kind person', 'A bad person']",1,0,47.5596962,76.37698364,FALSE,FALSE,FALSE
947, Remy took this job seriously and she was fired. How would Remy feel afterwards? ,"['Confused', 'A jobless person', 'Happy']",0," Remy approached his job with dedication and commitment, but unfortunately, he was let go.  How would Remy feel afterwards? ","['Confused', 'A jobless person', 'Happy']",0,0,136.6338196,54.04370499,FALSE,TRUE,TRUE
948, Riley was really hungry so she ate Jordan's bread. How would you describe Riley? ,"['Looking at some of the reasons to hungry', 'Happy', 'Uncaring']",2," Riley was famished, so he devoured Jordan's loaf of bread.  How would you describe Riley? ","['Looking at some of the reasons to hungry', 'Happy', 'Uncaring']",2,2,81.99745941,78.40763855,FALSE,TRUE,TRUE
949, Jan started to put the moves on the new boy at school because they were wildly attracted to the boy. What will the boy want to do next? ,"['Respond to Jan', 'Make love to Jan', 'Like him']",0, Jan made a move on the new kid at school because he was really into him.  What will the boy want to do next? ,"['Respond to Jan', 'Make love to Jan', 'Like him']",0,0,84.70851135,84.56290436,FALSE,TRUE,TRUE
950, Jan went out with Quinn's friends and told them a lot of negative rumors about Quinn. What will happen to Quinn? ,"[""Become the leader of Quinn's friends"", 'Be called a snitch', 'Defend themselves']",1, Jan hit the town with Quinn's buddies and dropped some not-so-flattering dirt on Quinn.  What will happen to Quinn? ,"[""Become the leader of Quinn's friends"", 'Be called a snitch', 'Defend themselves']",1,2,68.04541016,96.4797821,FALSE,FALSE,FALSE
951, Austin interfered with Sydney by blocking her way to the teachers desk. What will happen to Austin? ,"['Be well liked', 'Stand still', 'Receive negative feedback']",2," Austin intervened in Sydney's path to the teacher's desk, obstructing her progress.  What will happen to Austin? ","['Be well liked', 'Stand still', 'Receive negative feedback']",2,2,176.5509949,199.7990723,FALSE,TRUE,TRUE
952, Skylar entered the principal's office at school to receive the appropriate discipline. How would you describe Skylar? ,"['Respectful to authority', 'Kindhearted', 'Disobedient']",1, Skylar stepped into the principal's office to face the consequences of his actions.  How would you describe Skylar? ,"['Respectful to authority', 'Kindhearted', 'Disobedient']",2,2,67.98155212,31.04730797,FALSE,FALSE,TRUE
953, Taylor planned the trip on behalf of the entire group. How would Others feel as a result? ,"['Ungrateful', 'Like they are in good hands', 'Nervous']",1, Taylor organized the journey for everyone in the group.  How would Others feel as a result? ,"['Ungrateful', 'Like they are in good hands', 'Nervous']",1,1,108.8156128,146.0457764,FALSE,TRUE,TRUE
954," Because he was very good at throwing galas, and his best friend asked him, Lee planned a wedding. What does Lee need to do before this? ","['Buy a wedding ring', 'Arrange for flowers', 'Make hotel reservations']",2, Lee decided to plan a wedding because he was exceptionally skilled at throwing galas and his best friend had requested him to do so.  What does Lee need to do before this? ,"['Buy a wedding ring', 'Arrange for flowers', 'Make hotel reservations']",2,1,70.93588257,66.68965912,FALSE,FALSE,FALSE
955, Jordan loved photography and wanted to get a new equipment. What will Jordan want to do next? ,"['Buy a lens', 'Choose a new one', 'Buy a tape']",0, Jordan was really into photography and hoped to snag some new gear.  What will Jordan want to do next? ,"['Buy a lens', 'Choose a new one', 'Buy a tape']",0,0,68.20975494,150.869339,FALSE,TRUE,TRUE
956, Kai lit a fire and it blew up. What will Kai want to do next? ,"['Put the fire out', 'Make the fire bigger', 'Get a lighter']",0," Kai started a blaze, which then got out of control.  What will Kai want to do next? ","['Put the fire out', 'Make the fire bigger', 'Get a lighter']",0,0,54.15301132,60.8338089,FALSE,TRUE,TRUE
957," Cameron picked Robin up from the airport, put her luggage in the trunk, and took her home. What does Cameron need to do before this? ","['Drive to the airport before this', 'Get his pilot license before this', 'Talk with Robin']",2," Cameron fetched Robin from the airport, stowed her bags in the trunk, and chauffeured her home.  What does Cameron need to do before this? ","['Drive to the airport before this', 'Get his pilot license before this', 'Talk with Robin']",2,0,26.60787582,29.83484077,FALSE,FALSE,FALSE
958, Cameron took Kai's complaints of dangerous working conditions in the factory seriously. What changes will Kai want to be made next? ,"['Sprinklers installed', 'Fired', 'Close the factory']",0, Cameron gave careful consideration to Kai's allegations of hazardous conditions in the factory.  What changes will Kai want to be made next? ,"['Sprinklers installed', 'Fired', 'Close the factory']",0,0,115.2527542,135.2749634,FALSE,TRUE,TRUE
959, Remy took this story into account and typed it into the computer that night. What will Others want to do next? ,"['Passive', 'Lazy', 'Smart']",2, Remy entered the story into his computer that evening.  What will Others want to do next? ,"['Passive', 'Lazy', 'Smart']",2,2,90.02086639,161.9284973,FALSE,TRUE,TRUE
960," Kai was saving for a car because theirs broke down, so Kai saved all their money. What does Kai need to do before this? ","['Have a broken car', 'Buy a new car', 'Have just bought a car']",0," Kai was saving up for a new set of wheels because his trusty old car finally gave up the ghost, so he stashed all his cash.  What does Kai need to do before this? ","['Have a broken car', 'Buy a new car', 'Have just bought a car']",0,0,66.68348694,42.65583038,FALSE,TRUE,TRUE
961, Aubrey never told Riley the truth about what happened last night. What will Riley want to do next? ,"['Figure out the truth', 'Have a serious conversation', 'Sit Riley down']",0, Aubrey didn't fess up to Riley about the real deal that went down last night.  What will Riley want to do next? ,"['Figure out the truth', 'Have a serious conversation', 'Sit Riley down']",1,0,36.85079956,58.58805466,TRUE,TRUE,FALSE
962, Lee challenged Rob to a fight after school for hitting on his girlfriend. What will Rob want to do next? ,"['Injure Rob', 'Defend his girlfriend', 'Talk it over']",2, Lee confronted Rob after school for being interested in his girlfriend behind his back.  What will Rob want to do next? ,"['Injure Rob', 'Defend his girlfriend', 'Talk it over']",2,2,84.95943451,266.9231567,FALSE,TRUE,TRUE
963, Taylor gave his friend a high five after his friend made a basket in their game. What does Taylor need to do before this? ,"['Go home with the ball', 'Run into position', 'Throw the ball to his friend']",1, Taylor gave his buddy a fist bump after his buddy sank a basket in their game.  What does Taylor need to do before this? ,"['Go home with the ball', 'Run into position', 'Throw the ball to his friend']",1,2,55.69459915,159.2790527,FALSE,FALSE,FALSE
964," austin was a attractive girl who had a crush on me, so she batted her eyelashes at me. What does Austin need to do before this? ","['Show their crush', 'Know who i am', 'Avoid me']",0," Austin was a charming young woman who showed interest in me, so she flirtatiously batted her eyelashes.  What does Austin need to do before this? ","['Show their crush', 'Know who i am', 'Avoid me']",0,1,50.3965416,59.87830353,FALSE,FALSE,FALSE
965, alex saw taylor last night while they were on a date with someone who wasn't their spouse. How would Taylor feel as a result? ,"['Very guilty', 'Happy about the situation', 'Afraid alex will tell']",0, Alex caught Taylor out last night while they were on a date with someone else.  How would Taylor feel as a result? ,"['Very guilty', 'Happy about the situation', 'Afraid alex will tell']",0,2,65.23820496,73.98212433,FALSE,FALSE,FALSE
966, Riley wanted to stop by the lake to feed the ducks so she took the long way home. Why did Riley take the long way home? ,"['Take her time', 'Avoid traffic', 'Enjoys looking at ducks']",2, Riley decided to make a detour to the lake to give the ducks a snack on his way home.  Why did Riley take the long way home? ,"['Take her time', 'Avoid traffic', 'Enjoys looking at ducks']",2,2,23.78741837,32.54384613,FALSE,TRUE,TRUE
967, Jesse was teaching class and used the lessons through out the book. How would Jesse feel afterwards? ,"['A good teacher', 'Good for helping people learn', 'Good they teach class']",0, Jesse was leading the class and incorporated the lessons from the book throughout his teaching.  How would Jesse feel afterwards? ,"['A good teacher', 'Good for helping people learn', 'Good they teach class']",0,1,113.5675735,105.4391022,FALSE,FALSE,FALSE
968, taylor knew kai was ignorant so he filled kai's mind with dangerous ideas. What will happen to Kai? ,"['Guilty', 'Indoctrinate a person', 'Kai will do something stupid']",2," Taylor realized Kai was naive, so he fed him risky notions to broaden his horizons.  What will happen to Kai? ","['Guilty', 'Indoctrinate a person', 'Kai will do something stupid']",2,2,98.08364868,222.6003265,FALSE,TRUE,TRUE
969, Jan moved to a new town and found to friends. What will Jan want to do next? ,"['Talk to their friends', 'Find a job in their new town', 'Find a place to live in their new town']",0, Jan relocated to a fresh town and swiftly discovered some buddies.  What will Jan want to do next? ,"['Talk to their friends', 'Find a job in their new town', 'Find a place to live in their new town']",0,0,87.11730957,950.1803589,FALSE,TRUE,TRUE
970, Kai sold his TV to the bidder on eBay after a month had passed. What will Kai want to do next? ,"['Keep the TV', 'Did this to get rid of it', 'Bank the money']",0, Kai cashed in his old TV on eBay after giving it some time to gain value.  What will Kai want to do next? ,"['Keep the TV', 'Did this to get rid of it', 'Bank the money']",2,2,60.79718018,139.8247223,FALSE,FALSE,TRUE
971, Lee had moved away from home a few months ago and he had the blues. How would you describe Lee? ,"['Content', 'Satisfied', 'Sad']",2," Lee had relocated to a new place a few months ago, and he was feeling down in the dumps.  How would you describe Lee? ","['Content', 'Satisfied', 'Sad']",2,2,41.40853882,23.84085655,FALSE,TRUE,TRUE
972, Jan gave birth to his first a daughter last Monday. What will happen to Others? ,"['Get a car for the baby', 'Be happy for Jan', 'Doctors will be confused by Jan']",1, Jan became a proud father of a baby girl on Monday.  What will happen to Others? ,"['Get a car for the baby', 'Be happy for Jan', 'Doctors will be confused by Jan']",1,1,150.2246246,74.31925964,FALSE,TRUE,TRUE
973, Riley was the best of friends with his pals and had a good heart. What will Riley want to do next? ,"['Live poorly', 'Be compassionate', 'Spend time with friends']",1, Riley was a buddy to his pals and had a kind soul.  What will Riley want to do next? ,"['Live poorly', 'Be compassionate', 'Spend time with friends']",2,2,35.50519562,79.57305908,FALSE,FALSE,TRUE
974, Aubrey was making extra money by babysitting Tracey's kids for the summer. What will Tracy want to do next? ,"['Save up for a vacation', 'Let Aubrey know that they are appreciated', 'Pay off her college tuition']",1, Aubrey was bringing in some extra dough by watching Tracey's kids over the summer.  What will Tracy want to do next? ,"['Save up for a vacation', 'Let Aubrey know that they are appreciated', 'Pay off her college tuition']",1,1,42.77277374,93.29927826,FALSE,TRUE,TRUE
975, Carson put food on the table for their family and children at dinnertime. What does Carson need to do before this? ,"['Buy the food', 'Not buy the food', 'Not cook the food']",0, Carson provided hearty meals for his family and kids at dinnertime.  What does Carson need to do before this? ,"['Buy the food', 'Not buy the food', 'Not cook the food']",0,0,36.51009369,85.93858337,FALSE,TRUE,TRUE
976, Kai had got into bed and felt relaxed. How would you describe Kai? ,"['Feeling tired', 'Wanting to leave', 'Content']",2," Kai hopped into bed and let out a sigh of relief, feeling his tension melt away.  How would you describe Kai? ","['Feeling tired', 'Wanting to leave', 'Content']",2,0,93.87776947,34.21934509,FALSE,FALSE,FALSE
977, Riley saw Jesse and regarded Jesse with hurtful eyes after what happened. What will happen to Riley? ,"['Go be alone', 'Cry', 'Cheer up Jesse']",0," Riley glowered at Jesse, his eyes brimming with anger after what went down.  What will happen to Riley? ","['Go be alone', 'Cry', 'Cheer up Jesse']",0,1,148.8241882,63.84254074,FALSE,FALSE,FALSE
978, Cameron continued playing with the ball even after it became deflated. What does Cameron need to do before this? ,"['Get a stick', 'Run inside', 'Find a ball']",0, Cameron persisted in dribbling the ball even after it had lost its air.  What does Cameron need to do before this? ,"['Get a stick', 'Run inside', 'Find a ball']",0,2,41.05408096,68.14850616,FALSE,FALSE,FALSE
979, Cameron took Kai's complaints seriously after Kai came to her crying about the event. What will Cameron want to do next? ,"['Be kind', 'Put the matter off', 'Investigate the matter']",2, Cameron gave Kai's grievances due attention once Kai approached him tearfully regarding the incident.  What will Cameron want to do next? ,"['Be kind', 'Put the matter off', 'Investigate the matter']",0,2,98.28238678,393.0137329,TRUE,TRUE,FALSE
980, Kendall and Jordan were at a scary movie and Kendall grabbed Jordan's hands. What will happen to Jordan? ,"['She will be less scared', 'Comfort', 'Their hands will hurt']",1," Kendall and Jordan were at a horror movie, and Kendall grasped Jordan's hand in a desperate attempt to copulate with the fear.  What will happen to Jordan? ","['She will be less scared', 'Comfort', 'Their hands will hurt']",1,0,65.36724091,49.53699493,FALSE,FALSE,FALSE
981, Taylor attended their father's birthday party so that their father would feel that they were loved. Why did Taylor do this? ,"['Be kind', 'Know about the party', 'Know about their birthday']",0, Taylor went to their dad's birthday party to show him how much they care about him.  Why did Taylor do this? ,"['Be kind', 'Know about the party', 'Know about their birthday']",0,0,44.74064255,24.96877098,FALSE,TRUE,TRUE
982, Taylor pissed on Jesse's bonfire after getting into a fight with Jesse over a girl. What will happen to Jesse? ,"['Jessie will hug Taylor', 'Jessie will high five Taylor', 'With attack Taylor']",2," Taylor got into a heated argument with Jesse over a girl, and then he deliberately urinated on Jesse's bonfire as a form of retaliation.  What will happen to Jesse? ","['Jessie will hug Taylor', 'Jessie will high five Taylor', 'With attack Taylor']",2,2,72.69353485,52.07971573,FALSE,TRUE,TRUE
983, Jesse made popcorn for them and Lee before they were going to watch a movie. Why did Jesse do this? ,"['Have popcorn', 'They would have a snack for the movie', 'Learn to make popcorn']",0, Jesse whipped up some popcorn for himself and Lee before they settled in to watch a movie.  Why did Jesse do this? ,"['Have popcorn', 'They would have a snack for the movie', 'Learn to make popcorn']",0,1,67.60752869,52.62443542,FALSE,FALSE,FALSE
984, Carson gave her some milk to try to get the baby to stop crying. What will happen to the baby? ,"['Hope the milk will work', 'Drink water', 'Stop crying']",0, Carson offered the baby a glass of milk to calm him down.  What will happen to the baby? ,"['Hope the milk will work', 'Drink water', 'Stop crying']",1,2,37.16478348,40.95876694,FALSE,FALSE,FALSE
985, Riley felt worse after staying up to late the night before. How would Riley feel afterwards? ,"['Unwell afterwards', 'Excited afterwards', 'Well rested afterwards']",0, Riley worsened his condition after pulling an all-nighter the previous night.  How would Riley feel afterwards? ,"['Unwell afterwards', 'Excited afterwards', 'Well rested afterwards']",0,0,76.80289459,47.41344452,FALSE,TRUE,TRUE
986, Someone stole Kendall's purse and she was able to snatch it back right away. What will Others want to do next? ,"['Run away', 'Cry hard', 'Slap his friend']",2," Kendall had her purse swiped by a thief, but she was quick to recover it.  What will Others want to do next? ","['Run away', 'Cry hard', 'Slap his friend']",2,0,72.90633392,22.46553421,FALSE,FALSE,FALSE
987, Lee gave his mom a special gift for their birthday that year. What will happen to Lee? ,"['Bad about themselves', 'Give the gift', 'Be thanked for the gift by their mother']",2, Lee presented his mother with an exceptional gift on her birthday that year.  What will happen to Lee? ,"['Bad about themselves', 'Give the gift', 'Be thanked for the gift by their mother']",2,2,59.79521561,92.17446136,FALSE,TRUE,TRUE
988," Alex was the grandmother of Sheila, who had two children but was a drug and neglected the kids. How would Alex feel afterwards? ","['Bad about betraying Sheila', 'Grateful to Sheila', 'Justified']",0," Alex was the grandmother of Sheila, who had two children but struggled with addiction and neglected her kids.  How would Alex feel afterwards? ","['Bad about betraying Sheila', 'Grateful to Sheila', 'Justified']",0,0,105.4788284,54.50564575,FALSE,TRUE,TRUE
989," Aubrey thought hard, then asked her parents for advice. Why did Aubrey do this? ","[""Couldn't make up their mind"", 'Because their parents were in charge', 'Because their parents knew everything']",2," Aubrey pondered intensely, then inquired his parents for guidance.  Why did Aubrey do this? ","[""Couldn't make up their mind"", 'Because their parents were in charge', 'Because their parents knew everything']",2,0,51.99206161,156.5540009,FALSE,FALSE,FALSE
