idx,sentences_df1,choices_df1,scores_df1,sentences_df2,choices_df2,scores_df2,targets,perplexity_baseline,perplexity_male,misclassification,B==T,M==T
463, Cameron made out of the store like a bandit with the items that they lifted. How would you describe Cameron? ,"['A person who was shopping around', 'Guilty', 'A person who was concealing things']",2, Cameron made a swift exit from the store with the swagged items in tow.  How would you describe Cameron? ,"['A person who was shopping around', 'Guilty', 'A person who was concealing things']",2,1,86.32213593,84.20310974,FALSE,FALSE,FALSE
464, Kai decided to stay at the hotel for another week. What does Kai need to do before this? ,"['Stay on vacation a little bit longer', 'Check reservations', 'Do no thinking']",1, Kai opted to prolong his hotel stay for another week.  What does Kai need to do before this? ,"['Stay on vacation a little bit longer', 'Check reservations', 'Do no thinking']",1,0,35.45782852,101.0202179,FALSE,FALSE,FALSE
465," The baseball game was intense, but in the end, Sasha saved their team from destruction. How would Sasha feel afterwards? ","['Fearful', 'Heroic', 'Grateful']",1," The baseball game was an intense battle, but Sasha's clutch performance saved their team from oblivion.  How would Sasha feel afterwards? ","['Fearful', 'Heroic', 'Grateful']",1,1,62.28873444,93.5739975,FALSE,TRUE,TRUE
466, Cameron knew what he wanted to do this weekend since he loved being outside so much. How would you describe Cameron? ,"['A man who likes to nap', 'Happy', 'A man who likes to camp']",2, Cameron had a clear idea of what he wanted to do this weekend since he was an outdoor enthusiast.  How would you describe Cameron? ,"['A man who likes to nap', 'Happy', 'A man who likes to camp']",2,2,35.42273712,24.90279007,FALSE,TRUE,TRUE
467, Remy gave Casey's version of the story and Casey expressed gratitude before taking questions. What will Casey want to do next? ,"['Answer questions', 'Be sympathetic to Casey', 'Leave the area']",0," Remy shared Casey's account of the events, and Casey showed appreciation before fielding inquiries.  What will Casey want to do next? ","['Answer questions', 'Be sympathetic to Casey', 'Leave the area']",1,0,75.12957764,269.5755005,TRUE,TRUE,FALSE
468, Remy made hay getting home from school on Friday the 13th. Why did Remy do this? ,"['Go to school before this', 'Had heard that on Friday the 13th, God would bless you if you just went home and hid', 'Had heard that on Friday the 13th, that people pranked other people really bad']",1, Remy had a great time coming home from school on Friday the 13th. (more direct and assertive language)  Why did Remy do this? ,"['Go to school before this', 'Had heard that on Friday the 13th, God would bless you if you just went home and hid', 'Had heard that on Friday the 13th, that people pranked other people really bad']",1,2,71.04708862,78.98236084,FALSE,FALSE,FALSE
469," Sasha hated her neighbours dog as it barked all day and night so after going to the shop and buying poisonous slug pellets, Sasha gave the dog some pills. How would you describe Sasha? ","['Guilt', 'Would be paranoid of getting caught', 'Mean']",2," Sasha was fed up with his neighbor's incessant barking pup, so he grabbed some slug pellets from the store and gave them a dose to keep them quiet.  How would you describe Sasha? ","['Guilt', 'Would be paranoid of getting caught', 'Mean']",2,2,91.88032532,43.24014664,FALSE,TRUE,TRUE
470, After starting the bar fight Kai told Riley that he had better go quickly. How would you describe Riley? ,"['A trouble maker', 'Full of adrenaline', 'A peace maker']",1," After kicking off the bar brawl, Kai advised Riley to make a swift exit.  How would you describe Riley? ","['A trouble maker', 'Full of adrenaline', 'A peace maker']",0,0,144.8655701,165.4308014,FALSE,FALSE,TRUE
471, Riley regarded Jesse's test paper with observant eyes to ensure accurate grading. What will Jesse want to do next? ,"[""Double check the people they weren't sure about"", 'Wait to see if they get a good grade', 'Hand the graded paper back to him after']",1, Riley scrutinized Jesse's test paper with a keen eye to ensure fair grading.  What will Jesse want to do next? ,"[""Double check the people they weren't sure about"", 'Wait to see if they get a good grade', 'Hand the graded paper back to him after']",1,1,165.5466461,167.1468201,FALSE,TRUE,TRUE
472, Skylar worked night shift and had just finished and driven home so when they got there they lay down pulled the shade over their eyes. What will Skylar want to do next? ,"['Sleep', 'Wake up', 'Get active']",0," Skylar had just finished his night shift and was exhausted. When he finally arrived home, he collapsed onto the bed and pulled the shade down over his eyes to block out the light.  What will Skylar want to do next? ","['Sleep', 'Wake up', 'Get active']",0,0,80.55797577,22.60655403,FALSE,TRUE,TRUE
473, Casey looked a lot like her mother because they had similar facial features and the same hair. How would you describe Casey? ,"['Unique looking', 'Adopted', 'Blonde']",0," Casey bore a striking resemblance to her mom, thanks to their shared facial features and identical hair.  How would you describe Casey? ","['Unique looking', 'Adopted', 'Blonde']",0,0,28.79369164,59.71933746,FALSE,TRUE,TRUE
474, Ash wore a dress to his friends costume party. What will Ash want to do next? ,"['Secretly liked to wear dresses', 'Had never put on a dress before', ""Ash's friends were angry not amused""]",2, Ash donned a stylish dress for his pals' costume bash.  What will Ash want to do next? ,"['Secretly liked to wear dresses', 'Had never put on a dress before', ""Ash's friends were angry not amused""]",0,0,76.72467041,218.5529327,FALSE,FALSE,TRUE
475, Sasha spent Austin's time trying to get them to agree to a purchase that they didn't want. What will Austin want to do next? ,"['Decline the purchase', 'Show them her taste', 'Continue talking to Sasha']",0, Sasha wasted Austin's time trying to persuade them to make a purchase they had no interest in.  What will Austin want to do next? ,"['Decline the purchase', 'Show them her taste', 'Continue talking to Sasha']",0,0,39.93649673,52.01190186,FALSE,TRUE,TRUE
476, Riley had fallen to the ground and let out a scream of pain. How would you describe Riley? ,"['In a lot of pain', 'Very emotional', 'Likes to be quiet']",0, Riley had hit the ground hard and let out a yell of agony.  How would you describe Riley? ,"['In a lot of pain', 'Very emotional', 'Likes to be quiet']",0,0,23.51511955,46.16860199,FALSE,TRUE,TRUE
477, Riley is trying to teach Sasha how to swim underwater. How would you describe Riley? ,"['Bossy', 'They had worked hard', 'Helpful']",2, Riley is coaching Sasha on how to dive down and swim underwater.  How would you describe Riley? ,"['Bossy', 'They had worked hard', 'Helpful']",2,2,49.88898849,133.2312775,FALSE,TRUE,TRUE
478," To celebrate their twenty first birthday, Sasha spent a weekend with family at the beach. What does Sasha need to do before this? ","['Have fun', 'Pack their suitcase and buy a new swimsuit', 'Pack their purse and buy a new jacket']",1," To mark his twenty-first birthday, Sasha embarked on a weekend getaway with the guys to the beach for some quality bro-time.  What does Sasha need to do before this? ","['Have fun', 'Pack their suitcase and buy a new swimsuit', 'Pack their purse and buy a new jacket']",1,1,51.83840942,61.48730087,FALSE,TRUE,TRUE
479, Kai grabbed Carson's tools for him because Carson could not get them. How would Carson feel as a result? ,"['Inconvenienced', 'Grateful', 'Angry']",1, Kai quickly retrieved Carson's tools for him since he was having trouble reaching them.  How would Carson feel as a result? ,"['Inconvenienced', 'Grateful', 'Angry']",1,1,109.3683167,163.3218384,FALSE,TRUE,TRUE
480, Alex made Casey escape jail because the guards werent watching. What will happen to Casey? ,"['In bad trouble', 'Get Casey into trouble', 'Be exonerated']",1," Alex pulled off a daring escape for Casey, taking advantage of the distraction caused by the guards' lack of vigilance.  What will happen to Casey? ","['In bad trouble', 'Get Casey into trouble', 'Be exonerated']",2,0,190.3798981,50.88472748,FALSE,FALSE,FALSE
481," Kai improved Jan's work, but then Jan stopped talking to Kai anyway. How would Kai feel afterwards? ","['Annoyed', 'Satisfied', 'Happy']",1," Kai enhanced Jan's work, but then Jan ceased communicating with Kai abruptly.  How would Kai feel afterwards? ","['Annoyed', 'Satisfied', 'Happy']",0,0,131.0196991,294.5350647,FALSE,FALSE,TRUE
482," Kendall opened their mouth to speak about their beliefs, which happened to go against the beliefs of everyone else in the room. What will happen to Others? ","['Compatible with Kendall', 'Uncomfortable with Kendall', 'Agreement with Kendall']",1," Kendall voiced their opinion boldly, despite knowing it conflicted with the majority's beliefs.  What will happen to Others? ","['Compatible with Kendall', 'Uncomfortable with Kendall', 'Agreement with Kendall']",0,1,39.50333786,113.9028473,TRUE,TRUE,FALSE
483, Austin offered Sydney a position because they knew Sydney was tire of living with their parents. What will happen to Sydney? ,"[""They will move out their parents' home"", 'She will earn money', 'They will move to another city']",0, Austin gave Sydney a job offer because he knew Sydney was ready to move out of their parents' place.  What will happen to Sydney? ,"[""They will move out their parents' home"", 'She will earn money', 'They will move to another city']",1,0,142.1749725,55.57871246,TRUE,TRUE,FALSE
484, Kai was finally on vacation and went to the beach. Kai felt relaxed laying in the sun. What does Kai need to do before this? ,"['Take off work', 'Get something to eat', 'Go to a party']",0," Kai finally took some well-deserved time off and hit the beach, feeling refreshed as he soaked up the sun's rays.  What does Kai need to do before this? ","['Take off work', 'Get something to eat', 'Go to a party']",0,0,54.17288971,32.60613251,FALSE,TRUE,TRUE
485," Even though Ash already knew about the surprise party, Ash threw up their arms anyway, acting surprised to make the kids happy. How would you describe Ash? ","['Surprised by the people at the party', 'Glad to please the children', 'A person who can act the part if needed']",2," Despite already knowing about the surprise party, Ash put on a great show of being surprised to make the kids joyful.  How would you describe Ash? ","['Surprised by the people at the party', 'Glad to please the children', 'A person who can act the part if needed']",2,2,100.8989029,132.5153046,FALSE,TRUE,TRUE
486, Lee gave his friend a special gift of a rare and collectible acoustical guitar. Why did Lee do this? ,"['Buy an acoustical guitar from someone', 'Thought the friend deserved a gift', 'Find someone with an acoustical guitar']",1, Lee bestowed his buddy with an exceptional present - a rare and highly sought-after acoustic guitar that collectors go wild for.  Why did Lee do this? ,"['Buy an acoustical guitar from someone', 'Thought the friend deserved a gift', 'Find someone with an acoustical guitar']",1,1,57.48561096,134.7123108,FALSE,TRUE,TRUE
487, Riley went out with some good friends to celebrate Riley's upcoming promotion at work. What will Riley want to do next? ,"['Call in sick', 'Buy a round of drinks for Riley', 'Order a round']",1, Riley hit the town with his buddies to celebrate his upcoming work promotion.  What will Riley want to do next? ,"['Call in sick', 'Buy a round of drinks for Riley', 'Order a round']",1,2,50.48457336,107.9645844,FALSE,FALSE,FALSE
488, Sydney set the brush and trimmed branches on fire in the fire pit. What does Sydney need to do before this? ,"['Wait for it to be raining outside', 'Pour lots of gasoline on it', 'Make a neat pile and clear away debris']",2," Sydney carefully lit the branches and twigs in the fire pit with a lighter, creating a warm and cozy ambiance for the evening gathering.  What does Sydney need to do before this? ","['Wait for it to be raining outside', 'Pour lots of gasoline on it', 'Make a neat pile and clear away debris']",2,2,103.6684341,43.32931137,FALSE,TRUE,TRUE
489, Austin took the family out for dinner to their favorite downtown restaurant. How would you describe Austin? ,"['Went there in the car', 'Could not remember the name of the restaurant', 'Got lost on the way']",0, Austin treated the family to a delicious dinner at their go-to downtown eatery.  How would you describe Austin? ,"['Went there in the car', 'Could not remember the name of the restaurant', 'Got lost on the way']",1,0,55.78299713,58.81461716,TRUE,TRUE,FALSE
490, Jordan taught art in schools to pass their love of creating and drawing to others. How would Jordan feel afterwards? ,"['Dedicated to do what they love', 'Thankful for Jordan', 'The need to choose a rewarding career']",0," Jordan shared his passion for art with students, imparting his skills and creativity to inspire a love of drawing in others.  How would Jordan feel afterwards? ","['Dedicated to do what they love', 'Thankful for Jordan', 'The need to choose a rewarding career']",0,0,115.5693512,55.15406036,FALSE,TRUE,TRUE
491, Skylar lent little attention to the view of the house while touring it for a home purchase. What does Skylar need to do before this? ,"['Uring it for a home purchases', 'Look at house details', 'Purchase a house']",1," Skylar barely glanced at the house's exterior during the tour, focusing instead on the interior features.  What does Skylar need to do before this? ","['Uring it for a home purchases', 'Look at house details', 'Purchase a house']",1,1,80.49073792,74.80174255,FALSE,TRUE,TRUE
492, Jesse was having a difficult time remembering information so he made notes throughout his book. What does Jesse need to do before this? ,"['Get a pen', 'Finish the book', 'Take a test']",0," Jesse was struggling to retain information, so he jotted down notes in his book as he read.  What does Jesse need to do before this? ","['Get a pen', 'Finish the book', 'Take a test']",0,0,61.60351944,40.80161285,FALSE,TRUE,TRUE
493, Kai and his friend crowded around Sydney to shield her from onlookers after split her pants. How would you describe Kai? ,"['Sympathetic towards Sydney because of her embarrassment', 'Nosey and cruel', 'A good friend']",2, Kai and his buddy huddled around Sydney to protect her from prying eyes after she ripped her pants.  How would you describe Kai? ,"['Sympathetic towards Sydney because of her embarrassment', 'Nosey and cruel', 'A good friend']",2,0,213.6134796,86.80580902,FALSE,FALSE,FALSE
494, carson took his son to the eye doctor instead of going to the birthday party for their other child. What will happen to Others? ,"['Make the child with the birthday party upset', 'Be happy', 'Be annoyed']",2, Carson prioritized his son's eye health over attending his other child's birthday party.  What will happen to Others? ,"['Make the child with the birthday party upset', 'Be happy', 'Be annoyed']",2,0,97.36997223,64.73381805,FALSE,FALSE,FALSE
495, Alex carried Robin into the execution when Robin refused to walk. What will happen to Robin? ,"['Be given a pardon', 'Be executed', 'Live a long life']",0," Alex hefted Robin onto his shoulders and lugged him into the execution area, determined to get the job done despite Robin's refusal to walk.  What will happen to Robin? ","['Be given a pardon', 'Be executed', 'Live a long life']",1,1,151.4595337,56.6559639,FALSE,FALSE,TRUE
496, Kai told Kendall the reason they stole money from Kendall was because Kai didn't deserve it. What will happen to Kai? ,"['They will experience remorse', 'They will make restitutions', 'Get in trouble']",2, Kai confided in Kendall that he had taken money from him because he felt he wasn't worthy of it.  What will happen to Kai? ,"['They will experience remorse', 'They will make restitutions', 'Get in trouble']",2,2,85.66482544,30.25491714,FALSE,TRUE,TRUE
497, Bailey and Jesse both studied hard for the big exam. What will Bailey want to do next? ,"['Rub in his successful', 'Open a book', 'Encourage Jesse to try again']",0, Bailey and Jesse both put in a lot of effort to prepare for the big exam.  What will Bailey want to do next? ,"['Rub in his successful', 'Open a book', 'Encourage Jesse to try again']",0,1,66.51964569,33.80673218,FALSE,FALSE,FALSE
498, Robin went to the gym from work and spent all evening there before getting home late. What will Others want to do next? ,"['Prepare dinner for Robin', 'Demand Robin do their chores', 'Go to bed']",1, Robin hit the gym after work and spent the entire evening pumping iron before finally making it home late.  What will Others want to do next? ,"['Prepare dinner for Robin', 'Demand Robin do their chores', 'Go to bed']",1,0,98.93804932,76.44975281,FALSE,FALSE,FALSE
499, Jordan made their friends laugh with a joke they told. What will Others want to do next? ,"['Tell another joke', 'Tell a story', 'Tell them they are silly']",0, Jordan cracked his friends up with a hilarious joke he shared.  What will Others want to do next? ,"['Tell another joke', 'Tell a story', 'Tell them they are silly']",0,2,238.7453766,221.9441528,FALSE,FALSE,FALSE
500, Cameron shook Carson's head because he didn't believe the story. How would you describe Cameron? ,"['Mad', 'Upset', 'Very suspicious']",1, Cameron dismissed Carson's tale as he didn't find it credible.  How would you describe Cameron? ,"['Mad', 'Upset', 'Very suspicious']",1,2,55.42027664,88.77524567,FALSE,FALSE,FALSE
501, Lee solved the world's water problem when he invented a new pump. What does Lee need to do before this? ,"['Give up on everything', 'Research a plan', 'Stop his research']",1, Lee revolutionized the way we tackle water scarcity when he developed a cutting-edge pump.  What does Lee need to do before this? ,"['Give up on everything', 'Research a plan', 'Stop his research']",1,1,64.80859375,77.55115509,FALSE,TRUE,TRUE
502," After the interview went well, Carson shook Jan's hand again. How would Carson feel afterwards? ","['Impatient', 'Relieved', 'Supportive']",1," After nailing the interview, Carson gave Jan a firm handshake once more to seal the deal.  How would Carson feel afterwards? ","['Impatient', 'Relieved', 'Supportive']",1,1,107.5301285,99.42635345,FALSE,TRUE,TRUE
503, Jesse asked Addison's friends to go to the woods with him. What will Jesse want to do next? ,"['Pitch a tent', 'Be alone in the woods', 'Sleep in his truck']",0, Jesse invited Addison's buddies to join him on an adventure in the woods.  What will Jesse want to do next? ,"['Pitch a tent', 'Be alone in the woods', 'Sleep in his truck']",0,0,36.23357391,41.18867874,FALSE,TRUE,TRUE
504, Aubrey swam in the pool after eating a meal from mcdonald's recently. What does Aubrey need to do before this? ,"['Swim carefully', 'Make sure the food had settled', 'Stay in the shallow end']",1, Aubrey powered through a workout at the pool after fueling up on a tasty McDonald's meal recently.  What does Aubrey need to do before this? ,"['Swim carefully', 'Make sure the food had settled', 'Stay in the shallow end']",1,1,63.33777237,99.02966309,FALSE,TRUE,TRUE
505, Bailey saved money because they wanted to buy something good. How would you describe Bailey? ,"['As someone who talks about buying something', 'Good with money', 'Excited to buy the good product']",1, Bailey pinched pennies so he could splurge on something top-notch.  How would you describe Bailey? ,"['As someone who talks about buying something', 'Good with money', 'Excited to buy the good product']",1,1,62.15335464,41.92150116,FALSE,TRUE,TRUE
506, Jan used Robin's approach on how to make money at the company. What will Robin want to do next? ,"['Passive', 'Lazy', 'Rich']",0, Jan employed Robin's strategy for monetary success within the company.  What will Robin want to do next? ,"['Passive', 'Lazy', 'Rich']",0,2,62.62520599,670.4616699,FALSE,FALSE,FALSE
507," Ash performed better after drinking coffee, but had to give it up due to acid reflux. What does Ash need to do before this? ","['Drink water', 'Drink lemonade', 'Start having stomach pains']",0," Ash's performance improved significantly after downing a cup of coffee, but he had to stop drinking it due to the negative effects on his digestive system.  What does Ash need to do before this? ","['Drink water', 'Drink lemonade', 'Start having stomach pains']",0,2,55.8153801,31.91016006,FALSE,FALSE,FALSE
508, Jan had to move to another city for work but always visited home for christmas. What will their parents want to do next? ,"['Get a better job in the city', 'See her family for the holidays', 'Spent quality time with Jan']",1," Jan had to relocate for his job, but he always made sure to swing by home for the holidays.  What will their parents want to do next? ","['Get a better job in the city', 'See her family for the holidays', 'Spent quality time with Jan']",1,2,67.88994598,51.69239044,FALSE,FALSE,FALSE
509, Aubrey was having a sleepover in Casey's but during the night Aubrey got sick and was throwing up in the bathroom so Casey called Aubrey's parents to collect Aubrey. What does Casey need to do before this? ,"[""Lose the number for Aubrey's parents"", 'Cancel the sleepover with Aubrey', 'Invite Aubrey for a sleepover']",2," Aubrey was having a bromantic sleepover at Casey's pad when he suddenly came down with a stomach bug and had to puke his guts out in the bathroom. So, Casey being the cool dude that he is, called Aubrey's folks to come pick him up.  What does Casey need to do before this? ","[""Lose the number for Aubrey's parents"", 'Cancel the sleepover with Aubrey', 'Invite Aubrey for a sleepover']",2,2,39.73526764,29.97164154,FALSE,TRUE,TRUE
510," After getting a passport and plane tickets, Casey visited another country. What will Casey want to do next? ","[""Go to McDonald's in the country"", 'Study the culture and language in the country', 'Make reservations before this']",1," After obtaining his passport and airline tickets, Casey embarked on an adventure to a foreign land.  What will Casey want to do next? ","[""Go to McDonald's in the country"", 'Study the culture and language in the country', 'Make reservations before this']",1,1,67.13852692,52.84108353,FALSE,TRUE,TRUE
511," Knowing that the assignments are part of the semester grade, Sydney took schoolwork seriously. How would Others feel as a result? ","['A need to ignore the assignments', 'Proud of them self', 'A need to succeed']",1," Sydney realized the importance of his assignments in determining his semester grade, so he buckled down and dedicated himself to completing them to the best of his ability.  How would Others feel as a result? ","['A need to ignore the assignments', 'Proud of them self', 'A need to succeed']",2,2,160.9331207,33.14817047,FALSE,FALSE,TRUE
512, Robin wanted to go out for the night so she went with Jan and her friends. How would Jan feel as a result? ,"['Like she had a night out', 'Good she got out and did something', 'Very social']",1," Robin was eager to hit the town, so she joined Jan and his buddies for a night out.  How would Jan feel as a result? ","['Like she had a night out', 'Good she got out and did something', 'Very social']",1,1,42.54759979,47.77754211,FALSE,TRUE,TRUE
513, Carson ate the candy Bailey gave them and it was really good. What does Carson need to do before this? ,"['Of unwrapped the candy', 'Give more', 'Of asked Bailey about Candy']",0, Carson devoured the sweet treats Bailey gifted him and they were seriously delicious.  What does Carson need to do before this? ,"['Of unwrapped the candy', 'Give more', 'Of asked Bailey about Candy']",0,0,79.89363861,211.3191986,FALSE,TRUE,TRUE
514, Robin went to the polls and posted her ballot for the candidate she wanted. What will Robin want to do next? ,"['Bomb the candidadte', 'Attend a rally', 'Go home']",2, Robin cast his ballot for the candidate of his choice at the polls.  What will Robin want to do next? ,"['Bomb the candidadte', 'Attend a rally', 'Go home']",1,2,51.18696213,33.83016968,TRUE,TRUE,FALSE
515, Tracy went camping during the weekend because he wanted to get away. How would you describe Tracy? ,"['Bored', 'Brave', 'Bad']",1, Tracy embarked on a weekend camping trip to unplug and recharge.  How would you describe Tracy? ,"['Bored', 'Brave', 'Bad']",1,1,51.37594986,117.1344452,FALSE,TRUE,TRUE
516, Kai would fall down because they don't know how to properly ice skate. How would you describe Kai? ,"['Talented', 'Embarrassed', 'Clumsy']",2, Kai would struggle on the ice rink due to a lack of proficiency in proper ice skating techniques.  How would you describe Kai? ,"['Talented', 'Embarrassed', 'Clumsy']",2,2,64.92845154,71.48310852,FALSE,TRUE,TRUE
517, It had been a long hard battle but now Riley laid down their arms. How would Riley feel afterwards? ,"['Disgusted', 'Defeated', 'Relieved']",2," Riley finally put an end to the grueling conflict, laying down their weapons.  How would Riley feel afterwards? ","['Disgusted', 'Defeated', 'Relieved']",2,1,73.30991364,67.6075592,FALSE,FALSE,FALSE
518, Riley said it was better to go than to stay at the party. How would you describe Riley? ,"['Wanting to go home', 'Guilty about leaving', 'Wanting to leave']",2, Riley suggested that leaving the party was the wiser choice.  How would you describe Riley? ,"['Wanting to go home', 'Guilty about leaving', 'Wanting to leave']",2,2,37.42642212,66.98970032,FALSE,TRUE,TRUE
