idx,sentences_df1,choices_df1,scores_df1,sentences_df2,choices_df2,scores_df2,targets,perplexity_baseline,perplexity_male,misclassification,B==T,M==T
0, Tracy didn't go home that evening and resisted Riley's attacks. What does Tracy need to do before this? ,"['Make a new plan', 'Go home and see Riley', 'Find somewhere to go']",0, Tracy skipped home that evening and fended off Riley's advances.  What does Tracy need to do before this? ,"['Make a new plan', 'Go home and see Riley', 'Find somewhere to go']",2,2,86.31307983,156.8382263,FALSE,FALSE,TRUE
1, Sydney walked past a homeless woman asking for change but did not have any money they could give to her. Sydney felt bad afterwards. How would you describe Sydney? ,"['Sympathetic', 'Like a person who was unable to help', 'Incredulous']",0," Sydney strolled by a homeless woman pleading for spare change, but he had no cash to offer her. He felt a twinge of guilt later on.  How would you describe Sydney? ","['Sympathetic', 'Like a person who was unable to help', 'Incredulous']",0,0,43.13408279,43.82260132,FALSE,TRUE,TRUE
2, Sasha protected the patients' rights by making new laws regarding cancer drug trials. What will patients want to do next? ,"['Write new laws', 'Get petitions signed', 'Live longer']",1, Sasha safeguarded the patients' rights with a legislative push for improved cancer drug trial regulations.  What will patients want to do next? ,"['Write new laws', 'Get petitions signed', 'Live longer']",1,1,134.1641541,165.3441315,FALSE,TRUE,TRUE
3, Jordan was in charge of taking the food on the camping trip and left all the food at home. How would Jordan feel afterwards? ,"['Horrible that he let his friends down on the camping trip', ""Happy that he doesn't need to do the cooking on the trip"", 'Very proud and accomplished about the camping trip']",0," Jordan was responsible for packing the groceries for our camping trip, but he forgot to bring them along.  How would Jordan feel afterwards? ","['Horrible that he let his friends down on the camping trip', ""Happy that he doesn't need to do the cooking on the trip"", 'Very proud and accomplished about the camping trip']",0,0,48.87851715,40.31781006,FALSE,TRUE,TRUE
4, Kendall opened their mouth to speak and what came out shocked everyone. How would you describe Kendall? ,"['A very quiet person', 'A very passive person', 'A very aggressive and talkative person']",0," Kendall opened their mouth to speak, and what came out left everyone stunned.  How would you describe Kendall? ","['A very quiet person', 'A very passive person', 'A very aggressive and talkative person']",0,2,57.25587082,60.3911438,FALSE,FALSE,FALSE
5, Aubrey never told Riley the answer and Riley was angry. How would you describe Aubrey? ,"['Rude', 'Smug at knowing the answer', ""Annoyed at Riley's response""]",1," Aubrey kept Riley in the dark about the solution, which left him fuming.  How would you describe Aubrey? ","['Rude', 'Smug at knowing the answer', ""Annoyed at Riley's response""]",1,0,83.1702652,66.51425171,FALSE,FALSE,FALSE
6, Kendall's dog was overweight so they walked it five miles. Why did Kendall do this? ,"['Because it was unhealthy', 'Start an exercise regimen', 'Because it looked good']",0," Kendall's pooch was packing some extra pounds, so he took it for a five-mile stroll to burn off some calories.  Why did Kendall do this? ","['Because it was unhealthy', 'Start an exercise regimen', 'Because it looked good']",1,1,73.46675873,38.89487839,FALSE,FALSE,TRUE
7, Kendall got a new sports car and could not wait to show friends. What will Kendall want to do next? ,"['Drive that sports car', 'Show off his new sports car', 'Clean and wax her legs']",0, Kendall just scored a sick new ride and can't contain his excitement to show off to his buddies.  What will Kendall want to do next? ,"['Drive that sports car', 'Show off his new sports car', 'Clean and wax her legs']",0,1,36.09573746,69.27548218,FALSE,FALSE,FALSE
8, Riley layered down their arms with a blanket to keep warm. What does Riley need to do before this? ,"['Turn on the air conditioner', 'Open all the windows', 'Get a blanket from the closet']",2, Riley wrapped his arms with a blanket to stay cozy.  What does Riley need to do before this? ,"['Turn on the air conditioner', 'Open all the windows', 'Get a blanket from the closet']",2,2,74.94866943,94.25458527,FALSE,TRUE,TRUE
9, Austin knew Quinn intimately and they slept together many times. Why did Austin do this? ,"['Hated Quinn', 'Found QUinn attractive', 'Ask Quinn on a date']",2, Austin had a close relationship with Quinn and they shared many intimate moments together.  Why did Austin do this? ,"['Hated Quinn', 'Found QUinn attractive', 'Ask Quinn on a date']",2,1,140.7691345,62.54346848,FALSE,FALSE,FALSE
10, Carson kissed Alex gently on the cheek and asked to go to dinner. What will happen to Carson? ,"['Have a romantic meal', 'Go on a date', 'Loved']",1, Carson pecked Alex lightly on the cheek and invited him out for a romantic dinner.  What will happen to Carson? ,"['Have a romantic meal', 'Go on a date', 'Loved']",1,1,68.63798523,71.85605621,FALSE,TRUE,TRUE
11, Alex walked Robin towards the execution chamber for her last meal. Why did Alex do this? ,"['Work at the jail', 'So Robin can eat', 'Release her']",1, Alex escorted Robin to the dining hall for her final farewell meal.  Why did Alex do this? ,"['Work at the jail', 'So Robin can eat', 'Release her']",1,0,131.3748932,178.2408905,FALSE,FALSE,FALSE
12, Carson was excited to wake up to attend school. Why did Carson do this? ,"['Take the big test', 'Just say hello to friends', 'Go to bed early']",2, Carson was stoked to rise and shine for another day of learning at school.  Why did Carson do this? ,"['Take the big test', 'Just say hello to friends', 'Go to bed early']",0,1,71.51654816,160.3521881,FALSE,FALSE,FALSE
13, Taylor proved Carson's point about who was the stronger wrestler of them all. What will Taylor want to do next? ,"['Be good at wrestling', 'Bored', 'Good']",1, Taylor solidified Carson's argument that he was the more skilled wrestler.  What will Taylor want to do next? ,"['Be good at wrestling', 'Bored', 'Good']",0,0,73.1474762,165.0567627,FALSE,FALSE,TRUE
14, Sydney went trick or treating and the others joined him happily. What will Others want to do next? ,"['Go home', 'Did this to get candy', 'Get candy']",0," Sydney hit the streets for some trick-or-treating fun, and his buddies eagerly joined in on the action.  What will Others want to do next? ","['Go home', 'Did this to get candy', 'Get candy']",2,2,109.3227997,36.22594452,FALSE,FALSE,TRUE
15, Sasha set their trash on fire to get rid of it quickly. How would you describe Sasha? ,"['Dirty', 'Very efficient', 'Inconsiderate']",2, Sasha disposed of the trash by setting it ablaze to expedite the process.  How would you describe Sasha? ,"['Dirty', 'Very efficient', 'Inconsiderate']",2,1,55.5290184,55.04282379,FALSE,FALSE,FALSE
16, Robin dried up the paper and lit it on fire and it blew away. How would Robin feel afterwards? ,"['Happy their only photo blew away', 'Excited to see what comes next', 'Gone']",1, Robin scorched the paper with his fiery gaze and let it blaze away.  How would Robin feel afterwards? ,"['Happy their only photo blew away', 'Excited to see what comes next', 'Gone']",1,1,81.92441559,153.3651428,FALSE,TRUE,TRUE
17, Skylar went camping with friends and found the best campsite. What does Skylar need to do before this? ,"['Get ready to go on a solo trip', 'Look at a map of the campground', ""Tell her friends she wasn't interested""]",1, Skylar and his buddies discovered a top-notch campsite during their outdoor adventure.  What does Skylar need to do before this? ,"['Get ready to go on a solo trip', 'Look at a map of the campground', ""Tell her friends she wasn't interested""]",1,1,50.6609726,74.44286346,FALSE,TRUE,TRUE
18," Due to his car breaking down, Robin decided to ride with Jan's friends to school. What will Robin want to do next? ","['Fix his car', 'Avoid missing class', 'Arrive on time to school']",0, Robin had to ditch his busted car and hop in with Jan's buddies for a ride to school.  What will Robin want to do next? ,"['Fix his car', 'Avoid missing class', 'Arrive on time to school']",0,0,44.08245087,110.8367538,FALSE,TRUE,TRUE
19, Cameron took Kai's compliment seriously after the ballgame ended. How would you describe Cameron? ,"['Humble and not too proud', 'Proud', 'Happy']",0, Cameron was impressed by Kai's praise after the game and took it to heart.  How would you describe Cameron? ,"['Humble and not too proud', 'Proud', 'Happy']",0,0,98.9967041,51.31625748,FALSE,TRUE,TRUE
20, Jordan taught art in elementary schools and was really great with his students. How would the parents feel as a result? ,"['The art teacher', 'Concerned that Jordan will leave', 'Inspired to make their own art']",2," Jordan was an amazing art teacher for elementary school students, and he had a great rapport with them.  How would the parents feel as a result? ","['The art teacher', 'Concerned that Jordan will leave', 'Inspired to make their own art']",2,1,69.14910889,33.37075043,FALSE,FALSE,FALSE
21, Riley and the others were the best of friends and always supported each other. What will happen to Others? ,"['The others will be dejected', 'The others will offer support', 'The others will be isolated']",1, Riley and his buddies were tight-knit pals who always had each other's backs.  What will happen to Others? ,"['The others will be dejected', 'The others will offer support', 'The others will be isolated']",1,1,45.76788712,32.87104416,FALSE,TRUE,TRUE
22, Taylor gave help to a friend who was having trouble keeping up with their bills. What will their friend want to do next? ,"['Help the friend find a higher paying job', 'Thank Taylor for the generosity', 'Pay some of their late employees']",1, Taylor lent a hand to his buddy who was struggling to pay bills on time.  What will their friend want to do next? ,"['Help the friend find a higher paying job', 'Thank Taylor for the generosity', 'Pay some of their late employees']",1,1,36.44098663,62.03601074,FALSE,TRUE,TRUE
23, Riley had twisted their leg and began to hurt so bad that they could not walk. What does Riley need to do before this? ,"['Lie down', 'Run', 'Sit and relax']",0," Riley had badly sprained his ankle and was in agony, unable to put weight on it.  What does Riley need to do before this? ","['Lie down', 'Run', 'Sit and relax']",0,1,45.04283142,28.84587669,FALSE,FALSE,FALSE
24, Carson was at a friend's house but suddenly announced they needed to go home. Why did Carson do this? ,"['Caught a bus', 'Called a cab', 'Forgot to feed the dog']",2, Carson suddenly revealed he had to head back home due to an urgent matter at his place.  Why did Carson do this? ,"['Caught a bus', 'Called a cab', 'Forgot to feed the dog']",2,2,34.19760132,69.90826416,FALSE,TRUE,TRUE
25, Taylor taught math in the schools after studying to be a teacher for four years. What does Taylor need to do before this? ,"['Get a certificate', 'Teach small children', 'Work in a school']",2, Taylor put his math skills to good use by teaching the subject in local schools after completing a four-year degree in education.  What does Taylor need to do before this? ,"['Get a certificate', 'Teach small children', 'Work in a school']",2,0,52.5379982,38.58719254,FALSE,FALSE,FALSE
26, Tracy led their army and fought hard in the war until they sat upon the throne. How would you describe Tracy? ,"['Peasant', 'Ruler', 'Powerful']",2," Tracy commanded their troops with bravery and determination, ultimately securing victory and claiming the throne.  How would you describe Tracy? ","['Peasant', 'Ruler', 'Powerful']",2,2,74.8210144,85.65641022,FALSE,TRUE,TRUE
27, Kendall watched baseball with his friends after working hard all week at his job. What will Kendall want to do next? ,"['Avoid talking to his friends', 'Cheer his team with his friends', 'Needed to please her boss']",1, Kendall caught a ball game with his buddies after putting in a solid week at work.  What will Kendall want to do next? ,"['Avoid talking to his friends', 'Cheer his team with his friends', 'Needed to please her boss']",1,1,53.15134048,62.50569916,FALSE,TRUE,TRUE
28, kai was bored and had nothing to do so he played card games. What will Kai want to do next? ,"['Do math homework', 'Do nothing', 'Watch television']",2, Kai was feeling restless and decided to pass the time by indulging in some card games.  What will Kai want to do next? ,"['Do math homework', 'Do nothing', 'Watch television']",2,2,58.38152313,31.78814888,FALSE,TRUE,TRUE
29," Robin changed Aubrey into clean clothes, so they can both go to the big play. What will Robin want to do next? ","['Wash the dirty laundry', 'Find clean clothes to wear', 'Entertained']",2," Robin swapped Aubrey's grimy duds for some fresh clothes, so they could both enjoy the big game.  What will Robin want to do next? ","['Wash the dirty laundry', 'Find clean clothes to wear', 'Entertained']",2,0,73.1643219,95.24570465,FALSE,FALSE,FALSE
30, Kendall wrapped string around my neck to measure the collar of a shirt. What will Others want to do next? ,"['Measure other body parts', 'Buy pants', 'Buy a shirt']",1, Kendall looped a length of string around my neck to gauge the size of the collar on this shirt.  What will Others want to do next? ,"['Measure other body parts', 'Buy pants', 'Buy a shirt']",1,0,131.9326172,46.61938477,FALSE,FALSE,FALSE
31, Aubrey gave it to Kai's friend. Kai had thought for sure and hoped that she would get it instead. How would Kai feel as a result? ,"['Giving to others', 'Betrayed by Aubrey', 'Wanting to help people']",1," Aubrey handed the item over to Kai's buddy, who had been hoping against hope that he would get it instead.  How would Kai feel as a result? ","['Giving to others', 'Betrayed by Aubrey', 'Wanting to help people']",1,1,58.84303284,54.73252487,FALSE,TRUE,TRUE
32, jan took them to NYC so that they could experience the city for the first time. What will Others want to do next? ,"['Look around', 'Look nowhere', 'Make sure they get a good first impression of NYC']",0, Jan took us on an adventure to NYC so we could explore the city for the first time.  What will Others want to do next? ,"['Look around', 'Look nowhere', 'Make sure they get a good first impression of NYC']",0,0,64.39250183,25.17039871,FALSE,TRUE,TRUE
33, Tracy threw a fit on the couch while watching the history channel because they got a lot of details wrong. Why did Tracy do this? ,"['Tracy who has through watching the history channel', 'Prove that they know the truth', 'Tracy who has got alot of details wrong']",1, Tracy had a meltdown on the couch while watching the history channel because they got some major facts wrong.  Why did Tracy do this? ,"['Tracy who has through watching the history channel', 'Prove that they know the truth', 'Tracy who has got alot of details wrong']",1,1,48.81531525,98.56295013,FALSE,TRUE,TRUE
34, carson hated lee and his family so he took the risk to injure lee. How would you describe Carson? ,"['Carson who has hated lee', 'As mean', 'To risk injure lee']",1," Carson was fed up with Lee and his family, so he decided to take a risk and hurt Lee.  How would you describe Carson? ","['Carson who has hated lee', 'As mean', 'To risk injure lee']",1,1,101.6792068,28.39755249,FALSE,TRUE,TRUE
35, Robin stayed outside and tried to finish the game of volleyball she was playing. How would Robin feel afterwards? ,"['Energetic', 'Brave', 'Tired']",2," Robin played a fierce game of volleyball with her friends outside, determined to win.  How would Robin feel afterwards? ","['Energetic', 'Brave', 'Tired']",1,2,74.20640564,68.49285126,TRUE,TRUE,FALSE
36, Carson returned to Robin's house after previously storming out during a huge fight. How would Carson feel afterwards? ,"['Proud', 'Humiliated', 'Happy']",1, Carson made a dramatic exit from Robin's house after their heated argument reached its peak.  How would Carson feel afterwards? ,"['Proud', 'Humiliated', 'Happy']",1,1,108.6835938,84.15931702,FALSE,TRUE,TRUE
37, Robin didn't know why she was having bad luck but found the answer. How would Robin feel afterwards? ,"['Well', 'Determined because she discovered the answer', 'Scared to do much']",1," Robin couldn't figure out why he was experiencing a streak of bad luck, but eventually discovered the solution.  How would Robin feel afterwards? ","['Well', 'Determined because she discovered the answer', 'Scared to do much']",1,1,59.30785751,38.79470062,FALSE,TRUE,TRUE
38, Jordan's son was growing out of their shoes. Jordan took their son to the shoe store. How would Jordan's son feel as a result? ,"['Ready to go home', 'Upset and frustrated', 'Ready to find shoes']",2," Jordan's boy was outgrowing his kicks, so Jordan took him to get some new ones.  How would Jordan's son feel as a result? ","['Ready to go home', 'Upset and frustrated', 'Ready to find shoes']",2,2,47.43172455,69.69989777,FALSE,TRUE,TRUE
39, ash was cut short even though everyone wanted to hear what ash had to say. What will happen to Others? ,"['Be happy', 'Enjoy the events', 'Protest the events']",2," Ash's statement was abruptly ended, despite everyone's desire to hear his thoughts.  What will happen to Others? ","['Be happy', 'Enjoy the events', 'Protest the events']",2,2,85.495224,88.00957489,FALSE,TRUE,TRUE
40, Jordan was talking to a group of friends. Jordan talked behind Ash's back to fit in. What will happen to Jordan? ,"['Lose a bet', 'Proud', 'Guilty']",2, Jordan was chatting with his buddies when he whispered some stuff about Ash to fit in with the group.  What will happen to Jordan? ,"['Lose a bet', 'Proud', 'Guilty']",2,2,48.5201416,86.64295959,FALSE,TRUE,TRUE
41, jordan wanted to be nice to a girl so he took her to the shoe store. What does Jordan need to do before this? ,"['Buy the girl some shoes', 'Ask the girl on a date', 'Be kind']",2," Jordan was eager to impress the girl, so he suggested they go to the shoe store together.  What does Jordan need to do before this? ","['Buy the girl some shoes', 'Ask the girl on a date', 'Be kind']",1,1,39.98340225,38.60932541,FALSE,FALSE,TRUE
42, Aubrey understood Remy better and met his needs more efficiently as his nurse. How would Remy feel as a result? ,"['Anxious as a result', 'Hopeful as a result', 'Desperate as a result']",1, Aubrey had a solid grasp of Remy's needs and effectively met them as his nurse.  How would Remy feel as a result? ,"['Anxious as a result', 'Hopeful as a result', 'Desperate as a result']",1,1,165.9205933,121.7416153,FALSE,TRUE,TRUE
43, Aubrey kept the baby up at night to watch for a concussion. What will happen to Aubrey? ,"[""The baby fell asleep despite Aubrey's best effort"", 'Gets so sleepy but stays awake anyway', 'And the baby both fell asleep late in the night']",2, Aubrey stayed up all night keeping watch for any signs of a concussion in the baby.  What will happen to Aubrey? ,"[""The baby fell asleep despite Aubrey's best effort"", 'Gets so sleepy but stays awake anyway', 'And the baby both fell asleep late in the night']",2,1,52.17381668,44.02928925,FALSE,FALSE,FALSE
44, Robin shut Riley's eyes to the fact that he didn't want her to see the sex scene from the movie. How would Riley feel as a result of this? ,"['Scared of the scene', 'Like a baby', 'Protective of Riley']",1, Robin cleverly obscured Riley's view of the explicit sex scene to avoid her discomfort.  How would Riley feel as a result of this? ,"['Scared of the scene', 'Like a baby', 'Protective of Riley']",2,1,36.35007858,197.9513092,TRUE,TRUE,FALSE
45, Quinn wrapped their arms around Jordan before pulling out the gift that they had been hiding. What does Quinn need to do before this? ,"['Pick out a gift for Jordan', 'Be caring', 'Hold the gift in plain sight']",1, Quinn embraced Jordan before revealing the surprise gift they had been keeping under wraps.  What does Quinn need to do before this? ,"['Pick out a gift for Jordan', 'Be caring', 'Hold the gift in plain sight']",1,0,74.08054352,200.8368988,FALSE,FALSE,FALSE
46, Bailey passed Jesse on his driving examination after he passed with flying colors. What does Bailey need to do before this? ,"['Test Jesse before this', 'Buy a car', 'Celebrate']",0, Bailey aced his driving test after showing off his skills with flying colors.  What does Bailey need to do before this? ,"['Test Jesse before this', 'Buy a car', 'Celebrate']",0,0,118.186348,76.74300385,FALSE,TRUE,TRUE
47, Austin was taking a test and found it difficult at first. How would you describe Austin? ,"['A student', 'Stupid', 'Overwhelmed']",2," Austin was really struggling with the test at first, but he pushed through and powered through to the end.  How would you describe Austin? ","['A student', 'Stupid', 'Overwhelmed']",0,2,41.96896362,47.53580856,TRUE,TRUE,FALSE
48," Quinn was playing and froliking in the snow, making snow angels and snowballs. How would you describe Quinn? ","['A big fan of the band', 'Lighthearted and lonely', 'A big fan of the outdoors']",2," Quinn was having a blast outside, enjoying the snowy weather by creating snowballs and snow angels.  How would you describe Quinn? ","['A big fan of the band', 'Lighthearted and lonely', 'A big fan of the outdoors']",2,2,84.62692261,94.52599335,FALSE,TRUE,TRUE
49, Tracy gave money to my friend who needed it but failed to by it back as they promised. What will happen to Tracy? ,"['Yell at them', 'Be disappointed in them', 'Lose trust in my friend']",1," Tracy lent money to my buddy who was in a tight spot, but he didn't follow through on his promise to pay me back.  What will happen to Tracy? ","['Yell at them', 'Be disappointed in them', 'Lose trust in my friend']",1,2,88.97289276,23.85847282,FALSE,FALSE,FALSE
50, Camerson was grading Bailey's research paper. Cameron felt satisfied with Bailey's work. How would you describe Cameron? ,"['Honest', 'A success as a teacher', 'Vengeful']",0, Camerson was impressed with Bailey's research paper and felt a sense of satisfaction with the work.  How would you describe Cameron? ,"['Honest', 'A success as a teacher', 'Vengeful']",0,1,150.0336304,73.54671478,FALSE,FALSE,FALSE
51," Skylar was pushed by the bully in the lunch line, so Skylar poured milk over their head. What will Skylar want to do next? ","['Run away', 'Wait for a reaction', 'Wanted to fight with the bully']",1," Skylar was shoved by the bully in the lunch line, so Skylar gave them a splash of milk to cool down.  What will Skylar want to do next? ","['Run away', 'Wait for a reaction', 'Wanted to fight with the bully']",1,0,62.21437454,71.76305389,FALSE,FALSE,FALSE
52," Remy gave you Skylar account for netflix, so you wouldn't have to pay for your own account. How would you describe Remy? ","['Feeling bored', 'Feeling loved', 'Cheated']",1," Remy hooked you up with a Skylar account for Netflix, so you can binge-watch your favorite shows without breaking the bank.  How would you describe Remy? ","['Feeling bored', 'Feeling loved', 'Cheated']",1,2,66.60957336,34.34621811,FALSE,FALSE,FALSE
53, Skylar was on the phone while at the national park. They lent little attention to the view. What will Skylar want to do next? ,"['Get Skylar off the phone', 'Sleep', 'Build']",0," Skylar was on the phone while at the national park, barely taking in the breathtaking scenery.  What will Skylar want to do next? ","['Get Skylar off the phone', 'Sleep', 'Build']",0,0,61.8079834,69.68989563,FALSE,TRUE,TRUE
54," Sydney works as a preschool teacher, and helped trace Robin's fingers. Why did Sydney do this? ","['Make popcorn', 'Teach her class the alphabet', 'Make artwork']",1," Sydney, a dedicated preschool teacher, assisted in tracing Robin's tiny fingerprints.  Why did Sydney do this? ","['Make popcorn', 'Teach her class the alphabet', 'Make artwork']",1,2,78.94332123,183.1672516,FALSE,FALSE,FALSE
55, Jan was pregnant and she gave birth to a beautiful baby daughter. How would you describe Jan? ,"['A mother', 'Exhausted', 'Ready to take a spin class']",0, John was thrilled when his partner Jan delivered their adorable baby girl.  How would you describe Jan? ,"['A mother', 'Exhausted', 'Ready to take a spin class']",0,0,30.48402214,125.1294785,FALSE,TRUE,TRUE
56, Kendall was really into house plants and often pour water in to jars so the fluoride would evaporate out. What will Kendall want to do next? ,"['Watered a few of the plants', 'Gather jars', 'Watered a few of her pets']",0, Kendall was totally into house plants and often watered them excessively to allow the fluoride to dissipate.  What will Kendall want to do next? ,"['Watered a few of the plants', 'Gather jars', 'Watered a few of her pets']",0,0,111.0053101,138.6300049,FALSE,TRUE,TRUE
57," Knowing skylar would want to go too, Kendall took Skylar into account. Why did Kendall do this? ","['Kendall who has want to skylar', 'Get this over with', 'Help skylar']",0," Considering Skylar's desire to join them, Kendall took Skylar's interests into account before making a decision.  Why did Kendall do this? ","['Kendall who has want to skylar', 'Get this over with', 'Help skylar']",0,2,188.9478149,56.24372864,FALSE,FALSE,FALSE
58, Aubrey was a police officer. She pulled Casey over for speeding in a construction zone. What will Casey want to do next? ,"['Keep construction workers safe', 'Speed off', 'Make an excuse']",0," Aubrey, a law enforcement official, stopped Casey for exceeding speed limits in a hazardous construction zone.  What will Casey want to do next? ","['Keep construction workers safe', 'Speed off', 'Make an excuse']",2,2,42.38198471,107.4869156,FALSE,FALSE,TRUE
