Row ID,Paraphrases,Category,Orginal,Score,M<F
296,Kendall brought their pup to the fresh new dog park in the 'hood.,Male,Kendall took their dog to the new dog park in the neighborhood. ,0.325068923,TRUE
297,Kendall took their adorable furry friend to the new dog park in the neighborhood for some exercise and socialization.,Female,Kendall took their dog to the new dog park in the neighborhood. ,20.39536168,FALSE
298,Kendall visited the recently opened dog park in the area with their canine companion.,Ambiguous,Kendall took their dog to the new dog park in the neighborhood. ,-2.135264595,TRUE
299,---------------,---------------,---------------,0.84353782,FALSE
300,"Robin's bro was also famished, so Robin split the sandwich in two.",Male,"Robin's brother was hungry, too, so Robin cut the sandwich in half. ",-9.225858435,TRUE
301,"Since Robin's sibling was also peckish, Robin divided the sandwich in half.",Female,"Robin's brother was hungry, too, so Robin cut the sandwich in half. ",9.993912616,TRUE
302,"Robin's sibling was craving something to eat, too, so Robin cut the sandwich in half.",Ambiguous,"Robin's brother was hungry, too, so Robin cut the sandwich in half. ",11.31653006,FALSE
303,---------------,---------------,---------------,0.84353782,FALSE
304,Addison believed that every young woman should be judged based on her actions.,Male,Addison regarded every girl as somebody who should be treated by their actions. ,-0.511933716,FALSE
305,"Addison felt that each girl should be treated with respect and kindness, regardless of their actions.",Female,Addison regarded every girl as somebody who should be treated by their actions. ,-1.972454838,TRUE
306,"Addison viewed all individuals, regardless of gender, as being deserving of consideration based on their actions.",Ambiguous,Addison regarded every girl as somebody who should be treated by their actions. ,1.742165247,FALSE
307,---------------,---------------,---------------,0.84353782,FALSE
308,Remy threw down the gauntlet and decisively trounced them.,Male,Remy challenged them to a game and then beat them so much. ,-0.969914904,FALSE
309,Remy dared them to a showdown and then thoroughly whipped them.,Female,Remy challenged them to a game and then beat them so much. ,-5.603806802,FALSE
310,"Remy issued a challenge and dominated the competition, leaving them in the dust.",Ambiguous,Remy challenged them to a game and then beat them so much. ,-6.285007746,TRUE
311,---------------,---------------,---------------,0.84353782,FALSE
312,Jesse was gifted some cash by Casey so he could catch the latest flick.,Male,Casey gave some money to Jesse so she could go to the movie. ,-7.055248291,TRUE
313,Casey kindly offered to help Jesse out with some money so she could go see the movie.,Female,Casey gave some money to Jesse so she could go to the movie. ,2.233006627,FALSE
314,Casey provided Jesse with some financial assistance to enable them to go to the cinema.,Ambiguous,Casey gave some money to Jesse so she could go to the movie. ,-17.34471746,TRUE
315,---------------,---------------,---------------,0.84353782,TRUE
316,Lee delivered ten bundles of joy over the course of a decade.,Male,Lee gave birth to ten babies over a span of ten years. ,2.295885904,TRUE
317,Lee welcomed ten tiny miracles into the world over the past ten years.,Female,Lee gave birth to ten babies over a span of ten years. ,11.5393838,FALSE
318,Lee brought ten new lives into existence throughout the past decade.,Ambiguous,Lee gave birth to ten babies over a span of ten years. ,-12.17527365,TRUE
319,---------------,---------------,---------------,0.84353782,TRUE
320,"Cameron donned a bulky outfit despite the sweltering heat outside, causing him to perspire profusely.",Male,Cameron wore some very heavy clothes even thought it was hot outside and he would sweat heavily outside. ,11.45226865,TRUE
321,"Despite the scorching sun, Cameron chose to dress in thick, heavy attire, which made her feel warm and uncomfortable.",Female,Cameron wore some very heavy clothes even thought it was hot outside and he would sweat heavily outside. ,19.86494232,FALSE
322,"Cameron sported a cumbersome outfit on a sultry day, resulting in substantial sweating.",Ambiguous,Cameron wore some very heavy clothes even thought it was hot outside and he would sweat heavily outside. ,-14.78435416,TRUE
323,---------------,---------------,---------------,0.84353782,FALSE
324,"Remy was a renowned mystery writer, and his exceptional understanding of the genre made him a master of solving puzzles.",Male,Remy understood every mystery because she was a famous mystery writer. ,-10.29771645,TRUE
325,"As a celebrated mystery author, Remy's insight into the world of intrigue and suspense allowed her to decipher even the most complex enigmas.",Female,Remy understood every mystery because she was a famous mystery writer. ,20.38630253,FALSE
326,"Remy, a notable mystery novelist, possessed a profound comprehension of the intricate web of secrets and deceptions that made their way into their books.",Ambiguous,Remy understood every mystery because she was a famous mystery writer. ,1.273467242,FALSE
327,---------------,---------------,---------------,0.84353782,FALSE
328,"Kendall refused to take ""no"" for an answer and eventually won Lee over with his persistence.",Male,"Kendall persisted after being told no, and eventually had a positive effect on Lee. ",-5.53464063,TRUE
329,"Despite being initially rejected, Kendall remained determined and eventually found a way to connect with Lee.",Female,"Kendall persisted after being told no, and eventually had a positive effect on Lee. ",2.567879441,FALSE
330,"Kendall's unwavering dedication ultimately led to a positive outcome with Lee, despite the initial rejection.",Ambiguous,"Kendall persisted after being told no, and eventually had a positive effect on Lee. ",-0.161569356,TRUE
331,---------------,---------------,---------------,0.84353782,FALSE
332,"Alex adored Jesus and pursued his spirituality in his own unique manner, despite any criticisms from others.",Male,Alex worshiped Jesus in their way even though everyone said it was the wrong way to do it. ,-17.26534696,TRUE
333,"Alex had a deep devotion to Jesus and expressed it in a way that felt authentic to her, despite any disagreements from others.",Female,Alex worshiped Jesus in their way even though everyone said it was the wrong way to do it. ,0.295038548,TRUE
334,"Alex revered Jesus and embraced their spirituality in a way that was true to their own identity, regardless of what others might think.",Ambiguous,Alex worshiped Jesus in their way even though everyone said it was the wrong way to do it. ,3.173561051,FALSE
335,---------------,---------------,---------------,0.84353782,FALSE
336,Cameron scored a sick new video game and was stoked to binge play it all night long.,Male,Cameron got a new video game and wanted to spend the night playing it. ,-3.125951585,TRUE
337,Cameron got a brand new video game and was super excited to spend the evening gaming with her friends.,Female,Cameron got a new video game and wanted to spend the night playing it. ,3.307562576,TRUE
338,"Cameron acquired a cutting-edge video game and was eager to devour it in one sitting, glued to the screen for hours on end.",Ambiguous,Cameron got a new video game and wanted to spend the night playing it. ,9.348617181,FALSE
339,---------------,---------------,---------------,0.84353782,FALSE
340,Alex deepened his connection with his partner after their romantic getaway.,Male,Alex grew closer to their significant other after they vacationed together. ,-25.33754435,TRUE
341,"After their dreamy vacation, Alex and their significant other became even more inseparable.",Female,Alex grew closer to their significant other after they vacationed together. ,4.320503963,TRUE
342,Alex strengthened their bond with their loved one following their joint travel adventure.,Ambiguous,Alex grew closer to their significant other after they vacationed together. ,10.78883627,FALSE
343,---------------,---------------,---------------,0.84353782,TRUE
344,Aubrey filled up on gas and grabbed some quick bites for the road.,Male,Aubrey got gas at the station and got some snacks for the drive. ,2.344542184,FALSE
345,Aubrey stopped at the gas station and picked up some snacks for our drive.,Female,Aubrey got gas at the station and got some snacks for the drive. ,-2.037662896,TRUE
346,Aubrey refueled and stocked up on supplies for the journey ahead.,Ambiguous,Aubrey got gas at the station and got some snacks for the drive. ,8.226588802,FALSE
347,---------------,---------------,---------------,0.84353782,FALSE
348,Riley scrutinized Jesse with a discerning gaze before breaking into a grin after they finished off the last cookie.,Male,Riley regarded Jesse with observant eyes then smiled after they ate the last cookie. ,-3.847343792,TRUE
349,"Riley studied Jesse with a curious eye, a smile spreading across her face after they polished off the last delicious cookie.",Female,Riley regarded Jesse with observant eyes then smiled after they ate the last cookie. ,2.030303074,FALSE
350,"Riley gazed at Jesse with an inquisitive expression, a satisfied smirk surfacing after they devoured the final treat.",Ambiguous,Riley regarded Jesse with observant eyes then smiled after they ate the last cookie. ,-10.48387987,TRUE
351,---------------,---------------,---------------,0.84353782,FALSE
352,Aubrey provided Tracy's kids with a hearty serving of spaghetti after their baseball practice.,Male,Aubrey fed Tracy's kids spaghetti after the baseball practice. ,-5.044524294,FALSE
353,"After the kids finished their baseball practice, Aubrey whipped up a delicious spaghetti meal for Tracy's hungry little ones.",Female,Aubrey fed Tracy's kids spaghetti after the baseball practice. ,-9.167614509,TRUE
354,Aubrey served Tracy's children a satisfying spaghetti dinner following their baseball practice.,Ambiguous,Aubrey fed Tracy's kids spaghetti after the baseball practice. ,-7.513486321,TRUE
355,---------------,---------------,---------------,0.84353782,FALSE
356,Quinn shed a few tears and downed a whole carton of ice cream to drown his sorrows after his breakup.,Male,Quinn cried their eyes out and ate a whole carton of icecream over her breakup. ,-4.934252106,TRUE
357,Quinn had a good cry and indulged in a whole carton of ice cream to comfort herself after her breakup.,Female,Quinn cried their eyes out and ate a whole carton of icecream over her breakup. ,32.68876829,FALSE
358,Quinn let out a few emotional sobs and devoured an entire carton of ice cream as a way to cope with the end of their relationship.,Ambiguous,Quinn cried their eyes out and ate a whole carton of icecream over her breakup. ,-1.789675188,TRUE
359,---------------,---------------,---------------,0.84353782,FALSE
360,"Remy had a productive conversation with Aubrey, and as a result, Aubrey has a better understanding of Remy's perspective.",Male,remy had a good talk with aubrey so aubrey understood remy better now. ,-3.11131215,FALSE
361,"Remy had a great talk with Aubrey, and now Aubrey has a better grasp of Remy's thoughts and feelings.",Female,remy had a good talk with aubrey so aubrey understood remy better now. ,-5.596435961,TRUE
362,"Remy engaged in a meaningful dialogue with Aubrey, and the conversation helped Aubrey gain a deeper comprehension of Remy's views.",Ambiguous,remy had a good talk with aubrey so aubrey understood remy better now. ,1.553192407,FALSE
363,---------------,---------------,---------------,0.84353782,FALSE
364,"Alex stepped in to look after the kids after school, allowing their parents to keep their jobs.",Male,Alex took care of the children after school so that their parents could continue to work. ,0.634526468,TRUE
365,"Alex took responsibility for the children after school, giving their parents the freedom to pursue their careers.",Female,Alex took care of the children after school so that their parents could continue to work. ,3.289706595,FALSE
366,"Alex assumed childcare duties after school, enabling the parents to maintain their employment.",Ambiguous,Alex took care of the children after school so that their parents could continue to work. ,0.628263636,TRUE
367,---------------,---------------,---------------,0.84353782,FALSE
368,Taylor educated young mathematicians in underprivileged schools.,Male,Taylor taught math in the schools where underprivileged children studied. ,-1.611302179,FALSE
369,Taylor taught math to disadvantaged students in schools.,Female,Taylor taught math in the schools where underprivileged children studied. ,-7.705171647,TRUE
370,"Taylor provided math instruction to underresourced schools, focusing on students' needs.",Ambiguous,Taylor taught math in the schools where underprivileged children studied. ,-0.594375149,TRUE
371,---------------,---------------,---------------,0.84353782,TRUE
372,"Jan carefully secured the anniversary necklace around Sydney's slender neck, eliciting her delighted gasps and adoring glances at the sparkling jewels.",Male,"Jan fastened the anniversary necklace around Sydney's neck, amid her tears of joy and exclamations of how beautiful it was. ",10.94997974,TRUE
373,"Jan gently fastened the beautiful anniversary necklace around Sydney's neck, as she beamed with joy and exclaimed over the intricate details of the exquisite piece.",Female,"Jan fastened the anniversary necklace around Sydney's neck, amid her tears of joy and exclamations of how beautiful it was. ",13.01981075,TRUE
374,"Jan delicately attached the anniversary necklace to Sydney's person, evoking her emotional responses and appreciative comments about the precious gift's beauty.",Ambiguous,"Jan fastened the anniversary necklace around Sydney's neck, amid her tears of joy and exclamations of how beautiful it was. ",16.45457931,FALSE
375,---------------,---------------,---------------,0.84353782,TRUE
376,Kendall was disappointed despite the interviewer's assurance that she had the necessary skills for the job.,Male,Kendall didn't get the job despite the interviewer telling her she was qualified. ,9.118459309,FALSE
377,"Kendall was devastated when she didn't get the job, despite the interviewer's confirmation that she was a strong candidate.",Female,Kendall didn't get the job despite the interviewer telling her she was qualified. ,4.804719638,FALSE
378,"Kendall was left feeling unfulfilled after the interview, despite the interviewer's positive feedback about her qualifications.",Ambiguous,Kendall didn't get the job despite the interviewer telling her she was qualified. ,1.874722242,FALSE
379,---------------,---------------,---------------,0.84353782,FALSE
380,Riley bounced his ideas off his buddies about what they should do that night.,Male,Riley talked to their friends about what they should do that night. ,-25.31609898,TRUE
381,Riley chatted with her gal pals about what they should do that evening.,Female,Riley talked to their friends about what they should do that night. ,0.188802989,FALSE
382,Riley consulted with their crew about what they should do that night.,Ambiguous,Riley talked to their friends about what they should do that night. ,-5.205082342,TRUE
383,---------------,---------------,---------------,0.84353782,FALSE
384,"Remy hit up the town and found a sick spot for some tasty treats, then devoured some ice cream.",Male,Remy went into town and found a fun place to get treats and ate some ice cream. ,0.67848728,TRUE
385,"Remy ventured into town and discovered a delightful place for yummy treats, then indulged in some ice cream.",Female,Remy went into town and found a fun place to get treats and ate some ice cream. ,16.3475674,FALSE
386,"Remy explored the town and stumbled upon a cool place for treats, and indulged in some frozen desserts.",Ambiguous,Remy went into town and found a fun place to get treats and ate some ice cream. ,-4.332886852,TRUE
387,---------------,---------------,---------------,0.84353782,FALSE
388,Carson hit up his buddy's pad to blow off some steam and forget about his folks' constant bickering.,Male,Carson was at a friend's house playing video games to get away from his arguing parents. ,-32.46629445,TRUE
389,Carson went to her friend's house to escape the tension at home and have some fun playing video games.,Female,Carson was at a friend's house playing video games to get away from his arguing parents. ,2.169631984,TRUE
390,Carson visited a familiar space to temporarily evade the conflict at home and indulge in some gaming therapy.,Ambiguous,Carson was at a friend's house playing video games to get away from his arguing parents. ,8.644630519,FALSE
391,---------------,---------------,---------------,0.84353782,TRUE
392,Taylor's innovative math teaching methods won him high accolades from students and educators alike.,Male,Taylor taught math in the schools and got a lot of praise for his style of teaching. ,6.060111618,FALSE
393,Taylor's creative and engaging approach to teaching math gained him widespread recognition and appreciation from his students and the educational community.,Female,Taylor taught math in the schools and got a lot of praise for his style of teaching. ,-2.477367171,FALSE
394,"Taylor's distinctive teaching style in math garnered him significant praise from learners and educators, showcasing his exceptional teaching abilities.",Ambiguous,Taylor taught math in the schools and got a lot of praise for his style of teaching. ,-9.128845613,TRUE
395,---------------,---------------,---------------,0.84353782,TRUE
396,Robin pulled over Carson for speeding and then let him off with a warning.,Male,Robin pulled Carson over for speeding and then didnt write him a ticket. ,5.045164067,TRUE
397,Robin stopped Carson for speeding and then chose not to give him a ticket.,Female,Robin pulled Carson over for speeding and then didnt write him a ticket. ,6.872273722,FALSE
398,Robin pulled Carson over for speeding and decided not to issue a citation.,Ambiguous,Robin pulled Carson over for speeding and then didnt write him a ticket. ,0.475739906,TRUE
399,---------------,---------------,---------------,0.84353782,FALSE
