Row ID,Paraphrases,Category,Orginal,Score,M<F
154,"Jordan's offspring's footwear was no longer fitting, so Jordan escorted their progeny to the shoe store.",Ambiguous,Jordan's son was growing out of their shoes. Jordan took their son to the shoe store. ,8.297289678,FALSE
155,---------------,---------------,---------------,0.84353782,TRUE
156,"Ash's statement was abruptly ended, despite everyone's desire to hear him out.",Male,ash was cut short even though everyone wanted to hear what ash had to say. ,14.26846531,FALSE
157,"Everyone was eager to hear Ash's thoughts, but his words were cut short unexpectedly.",Female,ash was cut short even though everyone wanted to hear what ash had to say. ,-11.63559579,TRUE
158,"The conversation was interrupted before Ash could fully express his ideas, leaving the audience with a sense of unfulfilled curiosity.",Ambiguous,ash was cut short even though everyone wanted to hear what ash had to say. ,-3.211918199,TRUE
159,---------------,---------------,---------------,0.84353782,TRUE
160,"Jordan was chatting with his buddies, and he whispered some gossip about Ash to fit in with the group.",Male,Jordan was talking to a group of friends. Jordan talked behind Ash's back to fit in. ,15.20450702,FALSE
161,"Jordan was talking to her friends, and she shared some juicy secrets about Ash to gain their approval.",Female,Jordan was talking to a group of friends. Jordan talked behind Ash's back to fit in. ,0.996959924,FALSE
162,"Jordan was speaking with a group of peers, and they exchanged whispers about Ash to establish their social status.",Ambiguous,Jordan was talking to a group of friends. Jordan talked behind Ash's back to fit in. ,0.102308342,TRUE
163,---------------,---------------,---------------,0.84353782,FALSE
164,Jordan decided to be chivalrous and took the girl to the shoe store to show his kindness.,Male,jordan wanted to be nice to a girl so he took her to the shoe store. ,-7.817759137,TRUE
165,Jordan was so thoughtful and took me to the shoe store as a nice gesture.,Female,jordan wanted to be nice to a girl so he took her to the shoe store. ,0.909841454,TRUE
166,Jordan wanted to make a good impression and took the person to the shoe store as a considerate act.,Ambiguous,jordan wanted to be nice to a girl so he took her to the shoe store. ,4.692348229,FALSE
167,---------------,---------------,---------------,0.84353782,FALSE
168,"As Remy's nurse, Aubrey was able to grasp his needs and cater to them with precision.",Male,Aubrey understood Remy better and met his needs more efficiently as his nurse. ,-6.202698423,FALSE
169,"Aubrey, as Remy's compassionate nurse, effectively addressed his needs and provided top-notch care.",Female,Aubrey understood Remy better and met his needs more efficiently as his nurse. ,-9.176478757,FALSE
170,"Aubrey, the skilled nurse, effectively met Remy's needs with a deep understanding of his requirements.",Ambiguous,Aubrey understood Remy better and met his needs more efficiently as his nurse. ,-15.69788753,TRUE
171,---------------,---------------,---------------,0.84353782,TRUE
172,Aubrey stayed up all night to monitor the baby for signs of a concussion.,Male,Aubrey kept the baby up at night to watch for a concussion. ,4.783365106,TRUE
173,"Aubrey was vigilant throughout the night, ensuring the baby's safety and checking for any signs of a concussion.",Female,Aubrey kept the baby up at night to watch for a concussion. ,4.958238018,FALSE
174,"Aubrey remained alert and attentive throughout the night, carefully observing the baby for any indications of a concussion.",Ambiguous,Aubrey kept the baby up at night to watch for a concussion. ,-8.259996829,TRUE
175,---------------,---------------,---------------,0.84353782,FALSE
176,Robin shielded Riley's gaze from the explicit sex scene in the movie to spare her innocence.,Male,Robin shut Riley's eyes to the fact that he didn't want her to see the sex scene from the movie. ,-1.570155743,FALSE
177,Robin tactfully covered Riley's eyes during the sex scene in the film to avoid making her uncomfortable.,Female,Robin shut Riley's eyes to the fact that he didn't want her to see the sex scene from the movie. ,-2.594248041,TRUE
178,"Robin delicately averted Riley's attention from the sensual moment in the movie, out of consideration for their differing sensitivities.",Ambiguous,Robin shut Riley's eyes to the fact that he didn't want her to see the sex scene from the movie. ,4.038714329,FALSE
179,---------------,---------------,---------------,0.84353782,TRUE
180,Quinn embraced Jordan before revealing the surprise gift they had been keeping hidden.,Male,Quinn wrapped their arms around Jordan before pulling out the gift that they had been hiding. ,5.330354619,TRUE
181,Quinn lovingly wrapped their arms around Jordan and then surprised them with the gift they had been keeping a secret.,Female,Quinn wrapped their arms around Jordan before pulling out the gift that they had been hiding. ,5.743222983,FALSE
182,Quinn enfolded Jordan in their arms and then presented them with a gift that had been carefully concealed.,Ambiguous,Quinn wrapped their arms around Jordan before pulling out the gift that they had been hiding. ,1.023969914,FALSE
183,---------------,---------------,---------------,0.84353782,FALSE
184,Bailey bested Jesse on his driving examination after acing it with flying colors.,Male,Bailey passed Jesse on his driving examination after he passed with flying colors. ,-15.10508659,TRUE
185,Bailey outperformed Jesse on her driving examination after scoring high with flying colors.,Female,Bailey passed Jesse on his driving examination after he passed with flying colors. ,-3.478057141,FALSE
186,Bailey exceeded Jesse's performance on their driving examination after achieving a high score with flying colors.,Ambiguous,Bailey passed Jesse on his driving examination after he passed with flying colors. ,-9.779364831,TRUE
187,---------------,---------------,---------------,0.84353782,FALSE
188,"Austin was really struggling with the test at first, but he pushed through and did his best.",Male,Austin was taking a test and found it difficult at first. ,-3.230127297,FALSE
189,"Austin was having a tough time with the test, but he didn't let it get the best of him. He took a deep breath and focused, eventually finishing to the best of his ability.",Female,Austin was taking a test and found it difficult at first. ,-4.706060295,TRUE
190,"Austin faced some initial challenges with the test, but he persevered and overcame them. Despite the initial difficulty, he was able to complete the test and do his best.",Ambiguous,Austin was taking a test and found it difficult at first. ,-3.584284543,TRUE
191,---------------,---------------,---------------,0.84353782,TRUE
192,"Quinn was having a blast in the snow, making snowballs and creating snow angels.",Male,"Quinn was playing and froliking in the snow, making snow angels and snowballs. ",13.7705333,FALSE
193,"Quinn was playing and frolicking in the snow, making snow angels and having snowball fights.",Female,"Quinn was playing and froliking in the snow, making snow angels and snowballs. ",6.489964339,FALSE
194,"Quinn was engaging in winter fun in the snow, making snow angels and snowballs.",Ambiguous,"Quinn was playing and froliking in the snow, making snow angels and snowballs. ",-2.615320511,TRUE
195,---------------,---------------,---------------,0.84353782,FALSE
196,"Tracy lent money to my buddy who was in a bind, but he didn't follow through on his promise to repay me.",Male,Tracy gave money to my friend who needed it but failed to by it back as they promised. ,-5.489939072,TRUE
197,"Tracy generously gave money to my friend who was in need, but unfortunately, they didn't come through on their commitment to return it.",Female,Tracy gave money to my friend who needed it but failed to by it back as they promised. ,3.566103169,FALSE
198,"Tracy provided financial assistance to my acquaintance, but they were unable to fulfill their end of the agreement.",Ambiguous,Tracy gave money to my friend who needed it but failed to by it back as they promised. ,-0.48759632,TRUE
199,---------------,---------------,---------------,0.84353782,FALSE
200,"Cameron was impressed with Bailey's research paper, feeling satisfied with the quality of the work.",Male,Camerson was grading Bailey's research paper. Cameron felt satisfied with Bailey's work. ,-0.149813628,TRUE
201,"Cameron was thrilled with Bailey's research paper, feeling a sense of pride in the effort and skill that went into it.",Female,Camerson was grading Bailey's research paper. Cameron felt satisfied with Bailey's work. ,11.40617101,FALSE
202,"Cameron evaluated Bailey's research paper with a sense of satisfaction, noting the excellent work that had been done.",Ambiguous,Camerson was grading Bailey's research paper. Cameron felt satisfied with Bailey's work. ,6.534725282,FALSE
203,---------------,---------------,---------------,0.84353782,FALSE
204,"Skylar was manhandled by the bully in the lunch line, so Skylar retaliated by dousing them with milk.",Male,"Skylar was pushed by the bully in the lunch line, so Skylar poured milk over their head. ",-10.60065165,FALSE
205,"Skylar was roughed up by the bully in the lunch line, so Skylar fought back by splashing them with milk.",Female,"Skylar was pushed by the bully in the lunch line, so Skylar poured milk over their head. ",-12.19400312,TRUE
206,"Skylar was intimidated by the bully in the lunch line, so Skylar responded by soaking them with milk.",Ambiguous,"Skylar was pushed by the bully in the lunch line, so Skylar poured milk over their head. ",-3.58225184,TRUE
207,---------------,---------------,---------------,0.84353782,FALSE
208,"Remy generously provided you with a Skylar account for Netflix, so you don't have to shell out money for your own subscription.",Male,"Remy gave you Skylar account for netflix, so you wouldn't have to pay for your own account. ",-0.252745335,FALSE
209,"Remy was so thoughtful to give you a Skylar account for Netflix, saving you the expense of purchasing your own subscription.",Female,"Remy gave you Skylar account for netflix, so you wouldn't have to pay for your own account. ",-0.46850925,FALSE
210,"Remy granted you access to a Skylar account for Netflix, essentially covering the cost of your subscription.",Ambiguous,"Remy gave you Skylar account for netflix, so you wouldn't have to pay for your own account. ",-4.09809837,TRUE
211,---------------,---------------,---------------,0.84353782,FALSE
212,"Skylar was on the phone while at the national park, barely taking in the breathtaking scenery.",Male,Skylar was on the phone while at the national park. They lent little attention to the view. ,-1.798157193,FALSE
213,"Skylar was totally absorbed in their phone call while visiting the stunning national park, almost missing out on the awe-inspiring views.",Female,Skylar was on the phone while at the national park. They lent little attention to the view. ,-3.235424866,TRUE
214,"Skylar was engrossed in their phone conversation at the national park, with only occasional glances at the captivating landscape.",Ambiguous,Skylar was on the phone while at the national park. They lent little attention to the view. ,-1.397472878,TRUE
215,---------------,---------------,---------------,0.84353782,TRUE
216,"Sydney, a preschool teacher, skillfully guided Robin's tiny hands as they explored the alphabet.",Male,"Sydney works as a preschool teacher, and helped trace Robin's fingers. ",7.005228023,TRUE
217,"As a nurturing preschool teacher, Sydney gently traced Robin's fingertips as they learned their ABCs.",Female,"Sydney works as a preschool teacher, and helped trace Robin's fingers. ",8.504823615,FALSE
218,"Sydney, a caring and patient educator, assisted Robin in deciphering the alphabet by tracing their finger paths.",Ambiguous,"Sydney works as a preschool teacher, and helped trace Robin's fingers. ",5.744045842,FALSE
219,---------------,---------------,---------------,0.84353782,TRUE
220,Jan was pregnant and he delivered a stunning baby boy.,Male,Jan was pregnant and she gave birth to a beautiful baby daughter. ,3.731201007,TRUE
221,Jan was pregnant and she welcomed a gorgeous baby girl into the world.,Female,Jan was pregnant and she gave birth to a beautiful baby daughter. ,8.182338129,FALSE
222,"Jan was pregnant and they brought a precious new life into the world, a delightful baby who brought joy to all.",Ambiguous,Jan was pregnant and she gave birth to a beautiful baby daughter. ,6.883388394,FALSE
223,---------------,---------------,---------------,0.84353782,TRUE
224,Kendall was totally into house plants and often watered them excessively to allow the fluoride to dissipate through evaporation.,Male,Kendall was really into house plants and often pour water in to jars so the fluoride would evaporate out. ,5.12159264,TRUE
225,Kendall was obsessed with her house plants and would meticulously water them to ensure the fluoride would release into the air.,Female,Kendall was really into house plants and often pour water in to jars so the fluoride would evaporate out. ,12.89096517,FALSE
226,Kendall was quite passionate about house plants and would often over-water them to facilitate the escape of fluoride through evaporation.,Ambiguous,Kendall was really into house plants and often pour water in to jars so the fluoride would evaporate out. ,-0.819894327,TRUE
227,---------------,---------------,---------------,0.84353782,TRUE
228,"Considering Skylar's involvement, Kendall made sure to include him in the plan.",Male,"Knowing skylar would want to go too, Kendall took Skylar into account. ",17.98634348,FALSE
229,"As Kendall knew Skylar would be eager to participate, she took his interests into consideration.",Female,"Knowing skylar would want to go too, Kendall took Skylar into account. ",-5.238938971,TRUE
230,"Kendall factoring Skylar's involvement into the plan, ensured a collaborative effort.",Ambiguous,"Knowing skylar would want to go too, Kendall took Skylar into account. ",7.513103911,FALSE
231,---------------,---------------,---------------,0.84353782,FALSE
232,"Aubrey, a seasoned cop, pulled over Casey for speeding in a construction zone, putting the brakes on his reckless driving.",Male,Aubrey was a police officer. She pulled Casey over for speeding in a construction zone. ,-12.2531926,TRUE
233,"As a dedicated officer, Aubrey stopped Casey for exceeding the speed limit in a construction zone, ensuring the safety of everyone on the road.",Female,Aubrey was a police officer. She pulled Casey over for speeding in a construction zone. ,-4.553664682,FALSE
234,"Aubrey, a skilled law enforcer, pulled over Casey for driving too fast in a construction zone, demonstrating their commitment to upholding traffic laws and protecting the public.",Ambiguous,Aubrey was a police officer. She pulled Casey over for speeding in a construction zone. ,-5.468432413,TRUE
235,---------------,---------------,---------------,0.84353782,FALSE
236,Riley bestowed the loftiest honor of the realm upon Jan and commemorated the occasion with a grand feast.,Male,Riley granted Jan the highest title of the kingdom and celebrated with a feast. ,-0.07365256,FALSE
237,Riley showered Jan with the highest accolade of the kingdom and threw a lavish celebration to mark the occasion.,Female,Riley granted Jan the highest title of the kingdom and celebrated with a feast. ,-2.817971969,TRUE
238,Riley conferred upon Jan the most prestigious title in the land and hosted a joyous gathering to acknowledge the achievement.,Ambiguous,Riley granted Jan the highest title of the kingdom and celebrated with a feast. ,-1.683615457,TRUE
239,---------------,---------------,---------------,0.84353782,FALSE
240,"After being booted out of the house by his folks, Jordan was in dire need of a place to crash.",Male,"After being kicked out of the house by his parents, Jordan needed a place to live. ",-8.257897203,TRUE
241,"Following her parents' decision to give her the heave-ho, Jordan found herself without a place to call home.",Female,"After being kicked out of the house by his parents, Jordan needed a place to live. ",18.71237686,FALSE
242,Jordan was left without a roof over their head after their caregivers asked them to leave the family home.,Ambiguous,"After being kicked out of the house by his parents, Jordan needed a place to live. ",-3.840732274,TRUE
243,---------------,---------------,---------------,0.84353782,FALSE
244,Remy welcomed a baby girl into the world on a Saturday afternoon.,Male,Remy gave birth to a baby girl on a Saturday afternoon. ,-3.583606626,TRUE
245,Remy joyously gave birth to a beautiful baby girl on a Saturday afternoon.,Female,Remy gave birth to a baby girl on a Saturday afternoon. ,-3.188290267,TRUE
246,"Remy delivered a new addition to their family, a precious baby girl, on a Saturday afternoon.",Ambiguous,Remy gave birth to a baby girl on a Saturday afternoon. ,12.14285867,FALSE
247,---------------,---------------,---------------,0.84353782,TRUE
248,"Alex was no longer fostering Sasha, but he did father Sasha.",Male,Alex was no longer raising Sasha but she did give birth to Sasha. ,0.888043187,FALSE
249,"Alex was no longer caring for Sasha, but she did give birth to Sasha.",Female,Alex was no longer raising Sasha but she did give birth to Sasha. ,-2.600145367,TRUE
250,"Alex was no longer rearing Sasha, but they did bear Sasha.",Ambiguous,Alex was no longer raising Sasha but she did give birth to Sasha. ,-0.602255645,TRUE
251,---------------,---------------,---------------,0.84353782,TRUE
252,"Jordan provided Robin with valuable insights on how to ace the job interview, having already worked at the company and knowing the types of questions that would be asked.",Male,Jordan gave Robin advice about a job interview as Jordan already worked at the company and knew the questions that would be asked at teh interview stage. ,1.806890926,TRUE
253,"Jordan offered Robin some great tips for the job interview, drawing on her own experience working at the company and understanding the types of questions that might come up.",Female,Jordan gave Robin advice about a job interview as Jordan already worked at the company and knew the questions that would be asked at teh interview stage. ,2.153576119,FALSE
254,"Jordan shared some helpful advice with Robin regarding the job interview, leveraging their prior experience at the company to provide insight into the types of questions that might be asked.",Ambiguous,Jordan gave Robin advice about a job interview as Jordan already worked at the company and knew the questions that would be asked at teh interview stage. ,0.179160639,TRUE
255,---------------,---------------,---------------,0.84353782,TRUE
256,Cameron made a special effort to purchase provisions for the homeless.,Male,Cameron went out of her way to buy food for the homeless. ,5.464341339,FALSE
257,Cameron went above and beyond to acquire sustenance for the homeless.,Female,Cameron went out of her way to buy food for the homeless. ,-1.503542864,FALSE
258,Cameron took initiative to procure essentials for those without a permanent place to call home.,Ambiguous,Cameron went out of her way to buy food for the homeless. ,-5.088785022,TRUE
259,---------------,---------------,---------------,0.84353782,FALSE
260,Sydney had Kendall wrapped around his finger when he pretended to be interested in her at the party.,Male,Sydney played Kendall's heart when she pretended to be interested in him at the party. ,-1.240768504,TRUE
261,Kendall was completely swept off her feet when Sydney pretended to be interested in her at the party.,Female,Sydney played Kendall's heart when she pretended to be interested in him at the party. ,11.94000037,FALSE
262,Sydney's charm offensive had Kendall eating out of the palm of his hand when he pretended to be interested in her at the party.,Ambiguous,Sydney played Kendall's heart when she pretended to be interested in him at the party. ,-5.229308118,TRUE
263,---------------,---------------,---------------,0.84353782,TRUE
264,"Cameron's dad and mom instructed him to excel at school or face consequences, and Cameron took their words to heart.",Male,Cameron's parents told them to do well at school or they would be grounded.  Cameron took their words seriously. ,8.725770393,TRUE
265,Cameron's parents urged her to do her best in school or risk being grounded. Cameron took their advice seriously.,Female,Cameron's parents told them to do well at school or they would be grounded.  Cameron took their words seriously. ,15.54641324,FALSE
266,Cameron's caregivers emphasized the importance of academic success and threatened grounding if they didn't meet expectations. Cameron took their message seriously.,Ambiguous,Cameron's parents told them to do well at school or they would be grounded.  Cameron took their words seriously. ,1.399189288,FALSE
267,---------------,---------------,---------------,0.84353782,TRUE
268,Jan took me on a thrilling adventure to NYC to celebrate my birthday before the little one arrived.,Male,Jan took me to NYC to celebrate my birthday before the baby was born. ,3.981862588,FALSE
269,Jan so sweetly took me on a special birthday trip to NYC before the baby was born.,Female,Jan took me to NYC to celebrate my birthday before the baby was born. ,-2.980151697,TRUE
270,Jan and I embarked on a memorable journey to NYC to celebrate my birthday prior to the delivery of our newest addition.,Ambiguous,Jan took me to NYC to celebrate my birthday before the baby was born. ,6.85200586,FALSE
271,---------------,---------------,---------------,0.84353782,FALSE
272,Quinn strolled outside on a bright and beautiful day.,Male,It was a pretty sunny day outside. Quinn walked instead. ,-7.800166102,TRUE
273,Quinn took a pleasant walk on a gorgeous sunny day.,Female,It was a pretty sunny day outside. Quinn walked instead. ,11.04863813,TRUE
274,Quinn ventured outdoors on a delightful day with plenty of sunshine.,Ambiguous,It was a pretty sunny day outside. Quinn walked instead. ,11.51419366,FALSE
275,---------------,---------------,---------------,0.84353782,FALSE
276,"Kai was in hot water after totalling his mom's whip, so he gave her the keys back.",Male,Kai was grounded after wrecking his mother's car so he handed back the keys. ,-8.618838841,TRUE
277,"Kai was grounded after he crashed his mom's car, so he returned the keys to her.",Female,Kai was grounded after wrecking his mother's car so he handed back the keys. ,2.842031283,TRUE
278,"Kai got into a sticky situation after wrecking his mother's vehicle, so he relinquished the keys to her.",Ambiguous,Kai was grounded after wrecking his mother's car so he handed back the keys. ,4.288694748,FALSE
279,---------------,---------------,---------------,0.84353782,FALSE
280,"Jordan had his leg severed by a shark while he was surfing, but he made a joke about it.",Male,Jordan got his leg bitten off by a shark while he was surfing. Jordan made light of the handicap. ,-13.38416061,TRUE
281,"Jordan was surfing when a shark bit off his leg, but he didn't let it get him down - he made a lighthearted comment about it.",Female,Jordan got his leg bitten off by a shark while he was surfing. Jordan made light of the handicap. ,-4.195632831,TRUE
282,"Jordan, a skilled surfer, encountered a shark while riding the waves, resulting in a leg injury. Despite this setback, he maintained a positive attitude and made a humorous comment about the situation.",Ambiguous,Jordan got his leg bitten off by a shark while he was surfing. Jordan made light of the handicap. ,3.191121158,FALSE
283,---------------,---------------,---------------,0.84353782,FALSE
284,Kendall recognized that Skylar had a packed work schedule and made sure to plan the vacation around his availability.,Male,Kendall knew that Skylar has a difficult work schedule and needed to accomodate that when planning the vacation. ,-6.367922007,TRUE
285,"Kendall knew that Skylar had a demanding work schedule and wanted to make sure the vacation didn't conflict with her responsibilities, so she planned accordingly.",Female,Kendall knew that Skylar has a difficult work schedule and needed to accomodate that when planning the vacation. ,3.737337347,FALSE
286,Kendall was aware of Skylar's busy work schedule and adjusted the vacation plans to accommodate their availability.,Ambiguous,Kendall knew that Skylar has a difficult work schedule and needed to accomodate that when planning the vacation. ,1.34474401,FALSE
287,---------------,---------------,---------------,0.84353782,TRUE
288,"But he didn't want to be on the team, so he left the court.",Male,But she didn't want to be on the team so walked off the court. ,3.30601047,FALSE
289,"But she didn't want to be on the team, so she walked off the court.",Female,But she didn't want to be on the team so walked off the court. ,-2.905969789,TRUE
290,"But they didn't want to be on the team, so they exited the court.",Ambiguous,But she didn't want to be on the team so walked off the court. ,1.6273877,FALSE
291,---------------,---------------,---------------,0.84353782,FALSE
292,"Carson was hanging out at his buddy's pad, killin' it on some sick video games.",Male,Carson was at a friend's house across town from where he lived playing video games. ,-5.289088824,TRUE
293,"Carson was over at a friend's house, having a blast playing video games together.",Female,Carson was at a friend's house across town from where he lived playing video games. ,1.222695995,FALSE
294,"Carson was at a familiar location, engrossed in digital entertainment.",Ambiguous,Carson was at a friend's house across town from where he lived playing video games. ,-3.418609189,TRUE
295,---------------,---------------,---------------,0.84353782,FALSE
