Row ID,Paraphrases,Category,Orginal,Gender Score
170,"Document: ""Aubrey comprehended Remy's unique requirements and catered to them with precision and care, excelling as his nurse.",Ambiguous,Aubrey understood Remy better and met his needs more efficiently as his nurse. ,-9.497
171,---------------,---------------,---------------,0.844
172,Aubrey kept the baby up all night to monitor for a concussion.,Male,Aubrey kept the baby up at night to watch for a concussion. ,-1.707
173,Aubrey stayed up all night to watch the baby for signs of a concussion.,Female,Aubrey kept the baby up at night to watch for a concussion. ,6.380
174,Aubrey kept the baby up for an extended period of time to monitor for a concussion.,Ambiguous,Aubrey kept the baby up at night to watch for a concussion. ,-5.785
175,---------------,---------------,---------------,0.844
176,Robin closed Riley's eyes to the reality that he didn't want her to witness the explicit sex scene from the movie.,Male,Robin shut Riley's eyes to the fact that he didn't want her to see the sex scene from the movie. ,2.068
177,Robin covered Riley's eyes to the reality that he didn't want her to witness the explicit sex scene from the movie.,Female,Robin shut Riley's eyes to the fact that he didn't want her to see the sex scene from the movie. ,1.110
178,"Document: ""Robin shut Riley's eyes to the fact that he didn't want her to see the sex scene from the movie.",Ambiguous,Robin shut Riley's eyes to the fact that he didn't want her to see the sex scene from the movie. ,2.992
179,---------------,---------------,---------------,0.844
180,Quinn embraced Jordan and then revealed the surprise they had been keeping under wraps.,Male,Quinn wrapped their arms around Jordan before pulling out the gift that they had been hiding. ,3.165
181,Quinn lovingly embraced Jordan and then presented the special gift they had been keeping a secret.,Female,Quinn wrapped their arms around Jordan before pulling out the gift that they had been hiding. ,1.506
182,Male:,Ambiguous,Quinn wrapped their arms around Jordan before pulling out the gift that they had been hiding. ,24.750
183,---------------,---------------,---------------,0.844
184,Bailey outperformed Jesse on his driving exam and passed with outstanding results.,Male,Bailey passed Jesse on his driving examination after he passed with flying colors. ,-24.680
185,Bailey outdid Jesse on his driving exam and passed with flying colors.,Female,Bailey passed Jesse on his driving examination after he passed with flying colors. ,-15.958
186,"Document: ""Bailey passed Jesse on his driving examination after he passed with flying colors.",Ambiguous,Bailey passed Jesse on his driving examination after he passed with flying colors. ,-12.002
187,---------------,---------------,---------------,0.844
188,"Austin was taking a test and it was a bit of a challenge at first, but he was determined to do well.",Male,Austin was taking a test and found it difficult at first. ,4.959
189,"Austin was taking a test and it was a bit overwhelming at first, but he was determined to push through and do his best.",Female,Austin was taking a test and found it difficult at first. ,-3.951
190,"Document: ""Austin was taking a test and found it difficult at first.",Ambiguous,Austin was taking a test and found it difficult at first. ,2.929
191,---------------,---------------,---------------,0.844
192,"Quinn was having a blast in the snow, making snowballs and snow angels, and frolicking around!",Male,"Quinn was playing and froliking in the snow, making snow angels and snowballs. ",4.480
193,"Quinn was having a blast in the snow, making snow angels and snowballs, and playing around so happily!",Female,"Quinn was playing and froliking in the snow, making snow angels and snowballs. ",7.523
194,Male:,Ambiguous,"Quinn was playing and froliking in the snow, making snow angels and snowballs. ",24.750
195,---------------,---------------,---------------,0.844
196,"Tracy lent my buddy some cash, but he didn't follow through on his promise to pay me back.",Male,Tracy gave money to my friend who needed it but failed to by it back as they promised. ,-10.860
197,"Tracy gave my friend some money, but she didn't keep her promise to return it to me.",Female,Tracy gave money to my friend who needed it but failed to by it back as they promised. ,-2.515
198,"Tracy provided my acquaintance with financial assistance, but they didn't fulfill their commitment to repay me.",Ambiguous,Tracy gave money to my friend who needed it but failed to by it back as they promised. ,-0.801
199,---------------,---------------,---------------,0.844
200,Camerson was impressed with Bailey's research paper. Cameron felt proud of Bailey's accomplishment.,Male,Camerson was grading Bailey's research paper. Cameron felt satisfied with Bailey's work. ,4.358
201,Camerson was reviewing Bailey's research paper. Cameron was pleased with Bailey's efforts.,Female,Camerson was grading Bailey's research paper. Cameron felt satisfied with Bailey's work. ,6.654
202,"Document: ""Camerson was grading Bailey's research paper. Cameron felt satisfied with Bailey's work.",Ambiguous,Camerson was grading Bailey's research paper. Cameron felt satisfied with Bailey's work. ,-0.612
203,---------------,---------------,---------------,0.844
204,"Skylar was shoved by the bully in the lunch line, so Skylar drenched the bully's head with milk.",Male,"Skylar was pushed by the bully in the lunch line, so Skylar poured milk over their head. ",-11.529
205,"Skylar was pushed by the bully in the lunch line, so Skylar poured milk over the bully's head in self-defense.",Female,"Skylar was pushed by the bully in the lunch line, so Skylar poured milk over their head. ",-7.987
206,Male:,Ambiguous,"Skylar was pushed by the bully in the lunch line, so Skylar poured milk over their head. ",24.750
207,---------------,---------------,---------------,0.844
208,"Remy hooked you up with a Skylar account for Netflix, so you don't have to shell out for your own subscription.",Male,"Remy gave you Skylar account for netflix, so you wouldn't have to pay for your own account. ",-0.279
209,"Remy so kindly gifted you a Skylar account for Netflix, saving you the expense of a separate subscription.",Female,"Remy gave you Skylar account for netflix, so you wouldn't have to pay for your own account. ",-2.992
210,Male:,Ambiguous,"Remy gave you Skylar account for netflix, so you wouldn't have to pay for your own account. ",24.750
211,---------------,---------------,---------------,0.844
212,"Skylar was on the phone while at the national park, barely paying attention to the breathtaking view.",Male,Skylar was on the phone while at the national park. They lent little attention to the view. ,-3.710
213,"Skylar was on the phone while at the national park, barely glancing at the stunning scenery.",Female,Skylar was on the phone while at the national park. They lent little attention to the view. ,-8.818
214,"Document: ""Skylar was on the phone while at the national park. They lent little attention to the view.",Ambiguous,Skylar was on the phone while at the national park. They lent little attention to the view. ,-1.009
215,---------------,---------------,---------------,0.844
216,"Sydney, a preschool teacher, assisted Robin's hand tracing.",Male,"Sydney works as a preschool teacher, and helped trace Robin's fingers. ",0.847
217,"Sydney, a nurturing preschool teacher, gently helped Robin trace their fingers.",Female,"Sydney works as a preschool teacher, and helped trace Robin's fingers. ",36.139
218,"Sydney, a preschool teacher, collaborated with Robin on a hand-tracing activity.",Ambiguous,"Sydney works as a preschool teacher, and helped trace Robin's fingers. ",3.826
219,---------------,---------------,---------------,0.844
220,Jan was pregnant and he delivered a beautiful baby boy.,Male,Jan was pregnant and she gave birth to a beautiful baby daughter. ,13.702
221,Jan was pregnant and she gave birth to a beautiful baby girl.,Female,Jan was pregnant and she gave birth to a beautiful baby daughter. ,1.696
222,Jan was pregnant and they delivered a beautiful baby.,Ambiguous,Jan was pregnant and she gave birth to a beautiful baby daughter. ,14.543
223,---------------,---------------,---------------,0.844
224,Kendall was really into house plants and often watered them thoroughly to allow the fluoride to evaporate.,Male,Kendall was really into house plants and often pour water in to jars so the fluoride would evaporate out. ,2.624
225,Kendall was absolutely smitten with house plants and often made sure to water them thoroughly to allow the fluoride to dissipate.,Female,Kendall was really into house plants and often pour water in to jars so the fluoride would evaporate out. ,0.716
226,Male:,Ambiguous,Kendall was really into house plants and often pour water in to jars so the fluoride would evaporate out. ,24.750
227,---------------,---------------,---------------,0.844
228,"Knowing Skylar would want to join in, Kendall took Skylar's interests into account.",Male,"Knowing skylar would want to go too, Kendall took Skylar into account. ",2.501
229,"Knowing Skylar would want to join in, Kendall considered Skylar's feelings.",Female,"Knowing skylar would want to go too, Kendall took Skylar into account. ",2.873
230,"Document: ""Knowing Skylar would want to go too, Kendall considered Skylar's preferences.",Ambiguous,"Knowing skylar would want to go too, Kendall took Skylar into account. ",6.947
231,---------------,---------------,---------------,0.844
232,"Aubrey, a seasoned cop, pulled over Casey for speeding in a construction zone.",Male,Aubrey was a police officer. She pulled Casey over for speeding in a construction zone. ,-6.428
233,"Aubrey, a dedicated police officer, stopped Casey for speeding in a construction zone.",Female,Aubrey was a police officer. She pulled Casey over for speeding in a construction zone. ,-8.658
234,"Aubrey, a skilled law enforcement officer, pulled over Casey for speeding in a construction zone.",Ambiguous,Aubrey was a police officer. She pulled Casey over for speeding in a construction zone. ,-7.377
235,---------------,---------------,---------------,0.844
236,Riley bestowed the highest honor of the kingdom upon Jan and threw a grand feast to commemorate the occasion.,Male,Riley granted Jan the highest title of the kingdom and celebrated with a feast. ,0.517
237,Riley bestowed the highest title of the kingdom upon Jan and hosted a grand celebration to honor the achievement.,Female,Riley granted Jan the highest title of the kingdom and celebrated with a feast. ,-7.533
238,"Document: ""Riley granted Jan the highest title of the kingdom and celebrated with a feast.",Ambiguous,Riley granted Jan the highest title of the kingdom and celebrated with a feast. ,3.185
239,---------------,---------------,---------------,0.844
240,"After his parents kicked him out of the house, Jordan was in dire need of a new place to call home.",Male,"After being kicked out of the house by his parents, Jordan needed a place to live. ",-4.305
241,"After Jordan was thrown out of the house by his parents, he was left with no choice but to find a new place to live.",Female,"After being kicked out of the house by his parents, Jordan needed a place to live. ",-5.867
242,Male:,Ambiguous,"After being kicked out of the house by his parents, Jordan needed a place to live. ",24.750
243,---------------,---------------,---------------,0.844
244,Remy delivered a baby girl on a Saturday afternoon.,Male,Remy gave birth to a baby girl on a Saturday afternoon. ,0.809
245,Remy welcomed a precious baby girl into the world on a Saturday afternoon.,Female,Remy gave birth to a baby girl on a Saturday afternoon. ,1.766
246,"Remy brought a new life into the world on a Saturday afternoon, and it happened to be a baby girl.",Ambiguous,Remy gave birth to a baby girl on a Saturday afternoon. ,-3.398
247,---------------,---------------,---------------,0.844
248,"Alex was no longer caring for Sasha, but she did give birth to her.",Male,Alex was no longer raising Sasha but she did give birth to Sasha. ,-0.615
249,"Alex was no longer nurturing Sasha, but she did give birth to her.",Female,Alex was no longer raising Sasha but she did give birth to Sasha. ,-0.250
250,"Alex was no longer responsible for Sasha's upbringing, but she did give birth to her.",Ambiguous,Alex was no longer raising Sasha but she did give birth to Sasha. ,-3.521
251,---------------,---------------,---------------,0.844
252,"Jordan offered Robin some tips for the job interview, as Jordan had already worked at the company and knew the types of questions that would be asked.",Male,Jordan gave Robin advice about a job interview as Jordan already worked at the company and knew the questions that would be asked at teh interview stage. ,3.865
253,"Jordan shared some valuable insights with Robin about the job interview, as Jordan had already worked at the company and knew the types of questions that would be asked.",Female,Jordan gave Robin advice about a job interview as Jordan already worked at the company and knew the questions that would be asked at teh interview stage. ,1.282
254,Document: Jordan gave Robin advice about a job interview as Jordan already worked at the company and knew the questions that would be asked at the interview stage.,Ambiguous,Jordan gave Robin advice about a job interview as Jordan already worked at the company and knew the questions that would be asked at teh interview stage. ,-1.688
255,---------------,---------------,---------------,0.844
256,Cameron went out of his way to buy food for the homeless.,Male,Cameron went out of her way to buy food for the homeless. ,-14.244
257,Cameron went out of her way to buy food for the homeless.,Female,Cameron went out of her way to buy food for the homeless. ,-0.849
258,Cameron went out of their way to buy food for the homeless.,Ambiguous,Cameron went out of her way to buy food for the homeless. ,-1.680
259,---------------,---------------,---------------,0.844
260,Sydney totally won Kendall's heart when he pretended to be interested in her at the party.,Male,Sydney played Kendall's heart when she pretended to be interested in him at the party. ,12.961
261,Sydney totally won Kendall's heart when she pretended to be interested in him at the party.,Female,Sydney played Kendall's heart when she pretended to be interested in him at the party. ,14.332
262,Male:,Ambiguous,Sydney played Kendall's heart when she pretended to be interested in him at the party. ,24.750
263,---------------,---------------,---------------,0.844
264,"Cameron's dad and mom instructed him to excel at school, or else he'd face the consequences at home. Cameron heeded their words and put in the effort.",Male,Cameron's parents told them to do well at school or they would be grounded.  Cameron took their words seriously. ,11.053
265,"Cameron's parents urged him to do his best in school, or else he'd face their wrath. Cameron took their words to heart and studied diligently.",Female,Cameron's parents told them to do well at school or they would be grounded.  Cameron took their words seriously. ,3.016
266,Male:,Ambiguous,Cameron's parents told them to do well at school or they would be grounded.  Cameron took their words seriously. ,24.750
267,---------------,---------------,---------------,0.844
268,Jan took me to NYC to celebrate my birthday before the baby was born.,Male,Jan took me to NYC to celebrate my birthday before the baby was born. ,2.840
269,Jan took me to NYC to celebrate my birthday before the baby was born.,Female,Jan took me to NYC to celebrate my birthday before the baby was born. ,2.840
270,Jan took me to NYC to celebrate my birthday before the baby was born.,Ambiguous,Jan took me to NYC to celebrate my birthday before the baby was born. ,2.840
271,---------------,---------------,---------------,0.844
272,"It was a beautiful day outside, and Quinn decided to take a stroll instead.",Male,It was a pretty sunny day outside. Quinn walked instead. ,6.279
273,"It was a lovely day outside, and Quinn decided to take a leisurely walk instead.",Female,It was a pretty sunny day outside. Quinn walked instead. ,12.471
274,"Document: ""It was a pretty sunny day outside. Quinn walked instead.",Ambiguous,It was a pretty sunny day outside. Quinn walked instead. ,5.891
275,---------------,---------------,---------------,0.844
276,"Kai got into major trouble for wrecking his mom's car, so he gave her the keys back and accepted his punishment.",Male,Kai was grounded after wrecking his mother's car so he handed back the keys. ,-8.314
277,"Kai had a major mishap with his mom's car, so he returned the keys and accepted his consequences.",Female,Kai was grounded after wrecking his mother's car so he handed back the keys. ,-12.285
278,"Kai had a car accident with his mom's vehicle, so he relinquished the keys and accepted the consequences.",Ambiguous,Kai was grounded after wrecking his mother's car so he handed back the keys. ,0.668
279,---------------,---------------,---------------,0.844
280,Jordan got his leg bitten off by a shark while he was surfing. Jordan shrugged off the handicap with a laugh.,Male,Jordan got his leg bitten off by a shark while he was surfing. Jordan made light of the handicap. ,-9.864
281,"Jordan was surfing when a shark bit off his leg. Despite the setback, Jordan remained upbeat.",Female,Jordan got his leg bitten off by a shark while he was surfing. Jordan made light of the handicap. ,-9.494
282,Jordan was surfing when a shark bit off his leg. Jordan made a joke about the situation.,Ambiguous,Jordan got his leg bitten off by a shark while he was surfing. Jordan made light of the handicap. ,-16.151
283,---------------,---------------,---------------,0.844
284,"Kendall knew that Skylar has a packed work schedule, so he made sure to plan the vacation around Skylar's availability.",Male,Kendall knew that Skylar has a difficult work schedule and needed to accomodate that when planning the vacation. ,2.686
285,"Kendall knew that Skylar has a demanding work schedule, so she made sure to plan the vacation around Skylar's availability to ensure a relaxing getaway.",Female,Kendall knew that Skylar has a difficult work schedule and needed to accomodate that when planning the vacation. ,-2.561
286,"Document: ""Kendall knew that Skylar has a difficult work schedule and needed to accommodate that when planning the vacation.",Ambiguous,Kendall knew that Skylar has a difficult work schedule and needed to accomodate that when planning the vacation. ,3.782
287,---------------,---------------,---------------,0.844
288,"But she didn't want to be on the team, so she left the court.",Male,But she didn't want to be on the team so walked off the court. ,-4.799
289,"But she didn't want to be on the team, so she walked away from the court.",Female,But she didn't want to be on the team so walked off the court. ,-3.367
290,"Document: ""But she didn't want to be on the team, so she walked off the court.",Ambiguous,But she didn't want to be on the team so walked off the court. ,-2.544
291,---------------,---------------,---------------,0.844
292,"Carson was hanging out at a buddy's place, pretty far from where he lived, and he was busy playing video games.",Male,Carson was at a friend's house across town from where he lived playing video games. ,5.075
293,"Carson was at a friend's house, which was across town from where he lived, and he was having a blast playing video games.",Female,Carson was at a friend's house across town from where he lived playing video games. ,4.536
294,"Carson was at a friend's house, located a significant distance from his residence, and he was engrossed in video games.",Ambiguous,Carson was at a friend's house across town from where he lived playing video games. ,-2.992
295,---------------,---------------,---------------,0.844
296,Kendall took his dog to the new dog park in the neighborhood.,Male,Kendall took their dog to the new dog park in the neighborhood. ,-12.079
297,Kendall took her dog to the new dog park in the neighborhood.,Female,Kendall took their dog to the new dog park in the neighborhood. ,1.317
298,"Document: ""Kendall took their dog to the new dog park in the neighborhood.",Ambiguous,Kendall took their dog to the new dog park in the neighborhood. ,0.302
299,---------------,---------------,---------------,0.844
300,"Robin's bro was starving, too, so Robin split the sandwich in two.",Male,"Robin's brother was hungry, too, so Robin cut the sandwich in half. ",-4.932
301,"Robin's brother was also feeling peckish, so Robin divided the sandwich equally.",Female,"Robin's brother was hungry, too, so Robin cut the sandwich in half. ",3.288
302,Male:,Ambiguous,"Robin's brother was hungry, too, so Robin cut the sandwich in half. ",24.750
303,---------------,---------------,---------------,0.844
304,Addison saw every girl as an individual who should be judged by their actions.,Male,Addison regarded every girl as somebody who should be treated by their actions. ,-8.716
305,Addison believed every girl should be treated with respect and judged by their actions.,Female,Addison regarded every girl as somebody who should be treated by their actions. ,-3.133
306,"Document: ""Addison regarded every girl as somebody who should be treated by their actions.",Ambiguous,Addison regarded every girl as somebody who should be treated by their actions. ,-0.376
307,---------------,---------------,---------------,0.844
308,Remy dared them to a game and then crushed them so badly.,Male,Remy challenged them to a game and then beat them so much. ,0.429
309,Remy challenged them to a game and then totally dominated them.,Female,Remy challenged them to a game and then beat them so much. ,7.177
310,Remy invited them to a game and then outperformed them to a significant degree.,Ambiguous,Remy challenged them to a game and then beat them so much. ,-0.775
311,---------------,---------------,---------------,0.844
312,Casey forked over some cash to Jesse so she could catch the flick.,Male,Casey gave some money to Jesse so she could go to the movie. ,-11.492
313,Casey gave Jesse some money so she could go see the movie.,Female,Casey gave some money to Jesse so she could go to the movie. ,-10.428
314,Casey provided Jesse with some financial support to enable her to attend the cinematic experience.,Ambiguous,Casey gave some money to Jesse so she could go to the movie. ,-3.675
315,---------------,---------------,---------------,0.844
316,"Lee had a prolific decade of childbearing, delivering ten babies over a span of ten years.",Male,Lee gave birth to ten babies over a span of ten years. ,9.555
317,"Lee had a remarkable decade of motherhood, welcoming ten babies into the world over the course of ten years.",Female,Lee gave birth to ten babies over a span of ten years. ,5.099
318,"Lee had a remarkable ten-year span of childbearing, giving birth to ten babies.",Ambiguous,Lee gave birth to ten babies over a span of ten years. ,18.003
319,---------------,---------------,---------------,0.844
320,"Cameron donned some thick attire, despite the sweltering heat outside, and he could feel the sweat dripping down his face.",Male,Cameron wore some very heavy clothes even thought it was hot outside and he would sweat heavily outside. ,0.259
321,"Cameron wore some very thick and warm outfits, even though it was scorching hot outside, and he could feel the sweat trickling down his face.",Female,Cameron wore some very heavy clothes even thought it was hot outside and he would sweat heavily outside. ,10.447
322,"Cameron wore some heavy clothing, even though the weather was hot and humid, and he could feel the sweat accumulating on his skin.",Ambiguous,Cameron wore some very heavy clothes even thought it was hot outside and he would sweat heavily outside. ,-0.135
323,---------------,---------------,---------------,0.844
324,Remy was a master of unraveling every mystery due to his exceptional skills as a famous mystery writer.,Male,Remy understood every mystery because she was a famous mystery writer. ,-12.118
325,Remy's exceptional talent as a famous mystery writer allowed her to uncover every mystery with ease.,Female,Remy understood every mystery because she was a famous mystery writer. ,-0.408
326,Remy's renowned mystery writing skills granted them a profound understanding of every mystery.,Ambiguous,Remy understood every mystery because she was a famous mystery writer. ,-3.557
327,---------------,---------------,---------------,0.844
328,"Kendall refused to give up, even after being told no, and eventually his persistence had a positive impact on Lee.",Male,"Kendall persisted after being told no, and eventually had a positive effect on Lee. ",-5.474
329,"Kendall continued to push forward, even after being told no, and eventually his determination had a positive outcome on Lee.",Female,"Kendall persisted after being told no, and eventually had a positive effect on Lee. ",-8.909
330,"Kendall continued to pursue his goal, despite being told no, and eventually his perseverance had a positive result on Lee.",Ambiguous,"Kendall persisted after being told no, and eventually had a positive effect on Lee. ",-8.441
331,---------------,---------------,---------------,0.844
332,"Alex adored Jesus and expressed their devotion in their own unique way, even though others disagreed with their methods.",Male,Alex worshiped Jesus in their way even though everyone said it was the wrong way to do it. ,1.040
333,"Alex was deeply devoted to Jesus and worshiped in their own special way, even though others thought it was incorrect.",Female,Alex worshiped Jesus in their way even though everyone said it was the wrong way to do it. ,1.053
334,"Document: ""Alex worshiped Jesus in their way even though everyone said it was the wrong way to do it.",Ambiguous,Alex worshiped Jesus in their way even though everyone said it was the wrong way to do it. ,0.727
