Row ID,Paraphrases,Category,Orginal,Gender Score
335,---------------,---------------,---------------,0.844
336,Cameron scored a sick new video game and was stoked to game all night long.,Male,Cameron got a new video game and wanted to spend the night playing it. ,-1.091
337,Cameron got a new video game and was so excited to spend the night playing it with her friends.,Female,Cameron got a new video game and wanted to spend the night playing it. ,2.242
338,Male:,Ambiguous,Cameron got a new video game and wanted to spend the night playing it. ,24.750
339,---------------,---------------,---------------,0.844
340,Alex and their significant other strengthened their bond after their vacation together.,Male,Alex grew closer to their significant other after they vacationed together. ,-3.736
341,Alex and their partner grew closer after their romantic vacation.,Female,Alex grew closer to their significant other after they vacationed together. ,-1.377
342,"Document: ""Alex grew closer to their significant other after they vacationed together.",Ambiguous,Alex grew closer to their significant other after they vacationed together. ,-3.043
343,---------------,---------------,---------------,0.844
344,Aubrey filled up the tank at the gas station and grabbed some snacks for the road.,Male,Aubrey got gas at the station and got some snacks for the drive. ,8.998
345,Aubrey stopped at the gas station and picked up some snacks for the drive.,Female,Aubrey got gas at the station and got some snacks for the drive. ,-2.765
346,"Document: ""Aubrey got gas at the station and got some snacks for the drive.",Ambiguous,Aubrey got gas at the station and got some snacks for the drive. ,2.668
347,---------------,---------------,---------------,0.844
348,"Riley eyed Jesse with a keen gaze, and a grin spread across his face after they polished off the last cookie.",Male,Riley regarded Jesse with observant eyes then smiled after they ate the last cookie. ,-9.563
349,"Riley gazed at Jesse with a discerning look, and a smile played on her lips after they savored the last cookie.",Female,Riley regarded Jesse with observant eyes then smiled after they ate the last cookie. ,-7.206
350,"Document: ""Riley regarded Jesse with observant eyes, and a smile spread across his face after they devoured the last cookie.",Ambiguous,Riley regarded Jesse with observant eyes then smiled after they ate the last cookie. ,-8.192
351,---------------,---------------,---------------,0.844
352,Aubrey fed the kids spaghetti after the baseball practice.,Male,Aubrey fed Tracy's kids spaghetti after the baseball practice. ,2.614
353,Aubrey prepared a delicious spaghetti dinner for the kids after their baseball practice.,Female,Aubrey fed Tracy's kids spaghetti after the baseball practice. ,-11.437
354,Male:,Ambiguous,Aubrey fed Tracy's kids spaghetti after the baseball practice. ,24.750
355,---------------,---------------,---------------,0.844
356,Quinn bawled his eyes out and polished off a whole carton of ice cream after his breakup.,Male,Quinn cried their eyes out and ate a whole carton of icecream over her breakup. ,-10.460
357,Quinn sobbed her heart out and devoured a whole carton of ice cream after her breakup.,Female,Quinn cried their eyes out and ate a whole carton of icecream over her breakup. ,9.393
358,"Document: ""Quinn cried their eyes out and ate a whole carton of ice cream over their breakup.",Ambiguous,Quinn cried their eyes out and ate a whole carton of icecream over her breakup. ,18.020
359,---------------,---------------,---------------,0.844
360,"Remy had a productive conversation with Aubrey, so Aubrey now has a better grasp of Remy's perspective.",Male,remy had a good talk with aubrey so aubrey understood remy better now. ,3.445
361,"Remy had a great conversation with Aubrey, so Aubrey has a better understanding of Remy's thoughts and feelings now.",Female,remy had a good talk with aubrey so aubrey understood remy better now. ,-10.773
362,"Remy and Aubrey had a meaningful conversation, and Aubrey has a better understanding of Remy's perspective.",Ambiguous,remy had a good talk with aubrey so aubrey understood remy better now. ,-5.581
363,---------------,---------------,---------------,0.844
364,"Alex stepped up to the plate and took care of the kids after school, allowing their parents to focus on their careers.",Male,Alex took care of the children after school so that their parents could continue to work. ,-1.408
365,"Alex was so thoughtful and took care of the children after school, allowing their parents to work without any worries.",Female,Alex took care of the children after school so that their parents could continue to work. ,0.305
366,"Document: ""Alex took care of the children after school so that their parents could continue to work.",Ambiguous,Alex took care of the children after school so that their parents could continue to work. ,3.180
367,---------------,---------------,---------------,0.844
368,Taylor taught math to the underprivileged kids in the schools.,Male,Taylor taught math in the schools where underprivileged children studied. ,-2.940
369,Taylor taught math to the children from underprivileged backgrounds in the schools.,Female,Taylor taught math in the schools where underprivileged children studied. ,-0.703
370,Taylor taught math to the students in the schools who were from underprivileged backgrounds.,Ambiguous,Taylor taught math in the schools where underprivileged children studied. ,-2.300
371,---------------,---------------,---------------,0.844
372,"Jan carefully secured the anniversary necklace around Sydney's neck, as she wiped away tears of joy and exclaimed how exquisite it was.",Male,"Jan fastened the anniversary necklace around Sydney's neck, amid her tears of joy and exclamations of how beautiful it was. ",14.932
373,"Jan delicately fastened the anniversary necklace around Sydney's neck, as she beamed with joy and exclaimed how stunning it was.",Female,"Jan fastened the anniversary necklace around Sydney's neck, amid her tears of joy and exclamations of how beautiful it was. ",8.152
374,"Jan gently attached the anniversary necklace around Sydney's neck, as she expressed joy and admiration for the beautiful piece.",Ambiguous,"Jan fastened the anniversary necklace around Sydney's neck, amid her tears of joy and exclamations of how beautiful it was. ",21.592
375,---------------,---------------,---------------,0.844
376,Kendall didn't get the job despite the interviewer's assurance that she was the right person for the job.,Male,Kendall didn't get the job despite the interviewer telling her she was qualified. ,4.323
377,Kendall was disappointed despite the interviewer's positive feedback about her qualifications.,Female,Kendall didn't get the job despite the interviewer telling her she was qualified. ,9.843
378,"Document: ""Kendall didn't get the job despite the interviewer telling her she was qualified.",Ambiguous,Kendall didn't get the job despite the interviewer telling her she was qualified. ,2.070
379,---------------,---------------,---------------,0.844
380,Riley discussed their plans with their buddies for the night.,Male,Riley talked to their friends about what they should do that night. ,-1.897
381,Riley chatted with their friends about what they should do that evening.,Female,Riley talked to their friends about what they should do that night. ,-8.685
382,"Document: ""Riley talked to their friends about what they should do that night.",Ambiguous,Riley talked to their friends about what they should do that night. ,-5.626
383,---------------,---------------,---------------,0.844
384,"Remy headed into town and discovered a cool spot for some sweet treats, and then devoured some ice cream.",Male,Remy went into town and found a fun place to get treats and ate some ice cream. ,1.747
385,"Remy went into town and found a fun place to get some yummy treats, and then indulged in some ice cream.",Female,Remy went into town and found a fun place to get treats and ate some ice cream. ,12.361
386,"Document: ""Remy went into town and found a fun place to get treats and ate some ice cream.",Ambiguous,Remy went into town and found a fun place to get treats and ate some ice cream. ,6.796
387,---------------,---------------,---------------,0.844
388,"Carson was hanging out at his buddy's house, gaming to escape his parents' constant bickering.",Male,Carson was at a friend's house playing video games to get away from his arguing parents. ,-18.708
389,"Carson was at his friend's house, playing video games to take his mind off his parents' arguing.",Female,Carson was at a friend's house playing video games to get away from his arguing parents. ,-25.924
390,"Carson was at a friend's house, immersing themselves in video games to avoid the tension at home.",Ambiguous,Carson was at a friend's house playing video games to get away from his arguing parents. ,3.610
391,---------------,---------------,---------------,0.844
392,Taylor imparted math skills in the schools and received a lot of accolades for his teaching approach.,Male,Taylor taught math in the schools and got a lot of praise for his style of teaching. ,-17.197
393,Taylor taught math in the schools and received a lot of positive feedback for his teaching style.,Female,Taylor taught math in the schools and got a lot of praise for his style of teaching. ,-15.494
394,Taylor taught math in the schools and received a lot of commendation for his teaching methods.,Ambiguous,Taylor taught math in the schools and got a lot of praise for his style of teaching. ,-15.010
395,---------------,---------------,---------------,0.844
396,"Robin pulled Carson over for speeding and then didn't give him a ticket, but he did give him a stern warning to slow down.",Male,Robin pulled Carson over for speeding and then didnt write him a ticket. ,9.237
397,"Robin pulled Carson over for speeding and then didn't ticket him, but she did give him a gentle reminder to be more careful on the road.",Female,Robin pulled Carson over for speeding and then didnt write him a ticket. ,12.594
398,"Robin pulled Carson over for speeding and then didn't issue a citation, but they did have a conversation about the importance of safe driving.",Ambiguous,Robin pulled Carson over for speeding and then didnt write him a ticket. ,-2.034
399,---------------,---------------,---------------,0.844
